20200203, 오로라, 개인, 의류/패션/잡화/뷰티, http://smartstore.naver.com/aurora_light
20200203, 뷰티가이드, 유상덕, 의류/패션/잡화/뷰티, http://smartstore.naver.com/unocoss
20200203, 주방슈퍼, 오정윤, 컴퓨터/사무용품/ 의류/패션/잡화/뷰티, http://smartstore.naver.com/supkitchen
20200203, 미니 커머스(MINI Commerce), 김묘정, 종합몰/ 의류/패션/잡화/뷰티, http://smartstore.naver.com/healthbeautylab
20200203, 디아우스, 고경우, 가구/수납용품/ 의류/패션/잡화/뷰티, http://smartstore.naver.com/dyaus
20200203, 포네그라피, 신승훈, 의류/패션/잡화/뷰티, http://smartstore.naver.com/infrasnap
20200203, 마안, 김만중, 종합몰, http://smartstore.naver.com/pickupmall
20200203, 스텔라, 전용주, 의류/패션/잡화/뷰티, http://smartstore.naver.com/stellamn
20200203, 엔드앤앤드, 박정은, 의류/패션/잡화/뷰티, http://smartstore.naver.com/endnand_studio
20200203, 영진스토어(YJST), 김영진, 의류/패션/잡화/뷰티, http://smartstore.naver.com/yjst
20200203, 판다니, 개인, 교육/도서/완구/오락, http://smartstore.naver.com/pandany
20200203, 신나페이퍼아트플라워, SHEN MEIYING/이철무, 종합몰/ 기타, http://smartstore.naver.com/paperflower
20200203, 히든스탠다드, 홍지성, 의류/패션/잡화/뷰티, http://smartstore.naver.com/hiddenstandard
20200203, 다주기획, 한창일, 의류/패션/잡화/뷰티, http://smartstore.naver.com/dajuyoushop
20200203, 다주기획, 한창일, 의류/패션/잡화/뷰티, http://smartstore.naver.com/dajuyoushop
20200203, 더나임, 추민경, 종합몰/ 의류/패션/잡화/뷰티, http://smartstore.naver.com/thenaim
20200203, 리썸(lissome), 이찬양, 종합몰, http://smartstore.naver.com/lissome0
20200201, 그린내, 하영준, 종합몰, http://smartstore.naver.com/green_nae
20200201, 레아, 이수현, 의류/패션/잡화/뷰티, http://smartstore.naver.com/susuhyun09
20200131, 테테(TeTe), 유은정, 의류/패션/잡화/뷰티, http://smartstore.naver.com/tetetete
20200131, 수자매, 손미자, 의류/패션/잡화/뷰티, http://smartstore.naver.com/soojamae
20200131, 코나 클로젯, 이경화, 건강/식품/ 기타, http://smartstore.naver.com/kona-closet
20200131, 골드플레이, 김대광, 종합몰, http://smartstore.naver.com/goldplace
20200131, 라스트마일, 전영호, 종합몰/ 건강/식품, http://smartstore.naver.com/mmile
20200131, 비케이(BK) 스토어, 김정민, 종합몰, http://smartstore.naver.com/bk8887
20200131, 리미틀담(RIMITMDAL), 강수림, 의류/패션/잡화/뷰티, http://smartstore.naver.com/rimitmadal
20200131, 인애영농, 김혜연, 종합몰, http://smartstore.naver.com/iq1999
20200131, 원오픈, 조민준, 의류/패션/잡화/뷰티, http://smartstore.naver.com/oneoff_showroom
20200131, 더 나비드, 류지희, 의류/패션/잡화/뷰티, http://smartstore.naver.com/the_navid
20200131, 웰빙라이프, 김진, 기타/ 건강/식품, http://smartstore.naver.com/wellbeingslife
20200131, 르플랫(leplat), 윤채희, 건강/식품, http://smartstore.naver.com/leplat
20200131, 코코다엘, 이하나, 의류/패션/잡화/뷰티, http://smartstore.naver.com/cocodael
20200131, 티움, 이하나, 종합몰, http://smartstore.naver.com/_tium
20200131, 유통 다마고찌, 안효진, 기타, http://smartstore.naver.com/youbbo
20200131, 유어베어(your bear), 김창호, 의류/패션/잡화/뷰티, http://smartstore.naver.com/yourbear
20200131, 코코다엘, 이하나, 의류/패션/잡화/뷰티, http://smartstore.naver.com/cocodael
20200131, 인셀덤 임팩트(INCELLDERM IMPACT), 윤원정, 종합몰/ 건강/식품, http://smartstore.naver.com/imcellderm_impact
20200131, 천조마켓, 박창은, 종합몰, http://smartstore.naver.com/twoaa
20200131, 꼰대철물, 최금옥, 가구/수납용품, http://smartstore.naver.com/kkondae_store
20200130, 현지컴퍼니, 신현지, 의류/패션/잡화/뷰티, http://smartstore.naver.com/shjcompany
20200130, 아라베스크, 김애련, 의류/패션/잡화/뷰티, http://smartstore.naver.com/arabesque_shop
20200130, 중독팩토리, 김지유, 건강/식품/ 기타, http://smartstore.naver.com/addictionfactory
20200130, 와이앤케이리테일, 오나경, 종합몰, http://smartstore.naver.com/lets_do_it
20200130, 작은상자, 선종빈, 종합몰, http://smartstore.naver.com/shopwide
20200130, 바르니, 김대광, 종합몰, http://smartstore.naver.com/barun90
20200130, 비알커뮤니케이션즈(BRcommunications), 박종길, 가구/수납용품/ 기타, http://smartstore.naver.com/br_c
20200130, 모아나, 이은우, 의류/패션/잡화/뷰티, http://smartstore.naver.com/moana_pilyo (스토어팜)
20200130, 주식회사 맑음팩토리, 한건황, 가구/수납용품/ 기타, http://smartstore.naver.com/air-green
20200130, 케이링크(K-link), 황나나, 종합몰, http://smartstore.naver.com/k-link
20200130, 메종드루나, 김희영, 교육/도서/완구/오락/ 의류/패션/잡화/뷰티, http://smartstore.naver.com/storeluna
20200130, 재롱777, 임소연, 가구/수납용품, http://smartstore.naver.com/jelong777
20200130, 주야씨마켓, 구주아, 종합몰/ 의류/패션/잡화/뷰티, http://smartstore.naver.com/juuya
20200130, 에이아이홈, 김훈식, 종합몰, http://smartstore.naver.com/aihome
20200130, 에이앤제이하우스, 전은주, 건강/식품, http://smartstore.naver.com/mygreenfarm
20200130, 그린식스, 송경미, 종합몰, http://smartstore.naver.com/green6
20200130, 건강한아이템, 김태성, 기타, http://smartstore.naver.com/gunganghanitem
20200130, 망고상사, 최민구, 종합몰, http://smartstore.naver.com/mangosangsa
20200130, 비버상사, 허탁, 가전/ 의류/패션/잡화/뷰티, http://smartstore.naver.com/beaver-trade
20200130, 피플리치, 조용민, 종합몰, http://smartstore.naver.com/peoplerich
20200130, 돌코롬 88.7, 박보람, 종합몰, http://smartstore.naver.com/sweet_887
20200130, 엘리바스(Eliphaz), 박경난, 종합몰, http://smartstore.naver.com/eliphaz
20200130, 더니즈, 서민지, 의류/패션/잡화/뷰티, http://smartstore.naver.com/denise
20200130, 링크하다, 정미선, 교육/도서/완구/오락/ 기타, http://smartstore.naver.com/shopdc
20200130, 위플러스(We plus), 한채원, 의류/패션/잡화/뷰티, http://smartstore.naver.com/thechaylab
20200129, 어스온어스바이리우, 김서율, 종합몰, http://smartstore.naver.com/moonst
20200129, 홍유가인, 홍승범, 기타, http://smartstore.naver.com/hongyougain
20200129, 하루종일, 노경임, 종합몰, http://smartstore.naver.com/harubell
20200129, 소리와씨엔엠, 한은진, 종합몰, http://smartstore.naver.com/sorywashop
20200129, 홀릭제이, 주소진, 의류/패션/잡화/뷰티, http://smartstore.naver.com/holic_j
20200129, 아로이보르댕, 이정호, 종합몰, http://smartstore.naver.com/macho_life
20200129, 오로록(ororok), 이찬희, 종합몰, http://smartstore.naver.com/ororok
20200129, 럭키백, 이천숙, 종합몰, http://smartstore.naver.com/lluckybag
20200129, 밋미, 정미선, 의류/패션/잡화/뷰티, http://smartstore.naver.com/meetmi
20200129, 이안스프림, 김윤주, 종합몰/ 의류/패션/잡화/뷰티, http://smartstore.naver.com/bblime
20200129, 더블에이치(Double_H), 김혜현 외 1명, 의류/패션/잡화/뷰티, http://smartstore.naver.com/dh0201
20200129, 제이이즈백, 김정학, 의류/패션/잡화/뷰티, http://smartstore.naver.com/freshthings
20200129, 뽀야랑 콩이랑, 김현주, 기타, http://smartstore.naver.com/p_and_k
20200129, 하나텍 종합상사, 배석준, 종합몰, http://smartstore.naver.com/hanatec74
20200129, 준비운동, 정진원, 종합몰, http://smartstore.naver.com/readygo
20200129, 기린스토어, 조원기, 종합몰, http://smartstore.naver.com/hyoneed
20200129, 27스토어, 김대훈, 의류/패션/잡화/뷰티, http://smartstore.naver.com/blackxxheepwall
20200129, 포르테블루, 채수빈, 종합몰, http://smartstore.naver.com/glbd
20200129, 에이치제이코퍼레이션, 윤홍집, 종합몰, http://smartstore.naver.com/hjcorporation
20200129, 어썸 트렌드, 최문숙, 의류/패션/잡화/뷰티, http://smartstore.naver.com/kkh6544da
20200129, 은이, 이현수, 의류/패션/잡화/뷰티, http://smartstore.naver.com/eunn
20200129, 에스케이스토어, 김정민, 의류/패션/잡화/뷰티, http://smartstore.naver.com/skstory
20200129, 도복파는남자, 최경서, 의류/패션/잡화/뷰티/ 레저/여행/공연, http://smartstore.naver.com/hanggoo
20200129, 지구뿌셔, 이지구, 종합몰, http://smartstore.naver.com/ga-z-a
20200129, 감동시장, 박태형, 기타, http://smartstore.naver.com/idea0967
20200129, 뉴플러스가구, 김민섭, 가구/수납용품, http://smartstore.naver.com/newplusfurniture
20200129, 쇼핑의즐거움, 최경현, 컴퓨터/사무용품, http://smartstore.naver.com/easysell
20200129, 메타스쿨, 조형규, 건강/식품/ 의류/패션/잡화/뷰티, http://smartstore.naver.com/theredmaple
20200129, 베비뽀, 류민석, 교육/도서/완구/오락, http://smartstore.naver.com/babyshong
20200129, 티피마켓, 김일정, 종합몰, http://smartstore.naver.com/tpmarket
20200129, 미엘 (miel), 이미경, 의류/패션/잡화/뷰티, http://smartstore.naver.com/miel318
20200129, 헤이클레어, 노지수, 가구/수납용품/ 의류/패션/잡화/뷰티, http://smartstore.naver.com/merry-day
20200129, 스타일포키즈, 김소현, 의류/패션/잡화/뷰티, http://smartstore.naver.com/styleforkids
20200129, 롱타임노띵, 김도이, 기타, http://smartstore.naver.com/ttujji
20200129, 핌패스, 이수정, 의류/패션/잡화/뷰티, http://smartstore.naver.com/pimpass
20200129, 에몽상사, 윤상훈, 종합몰, http://smartstore.naver.com/e-mong
20200129, 잠못드는밤, 김영훈, 종합몰, http://smartstore.naver.com/sleeplessnight
20200129, 타이니데코, 안정숙, 종합몰, http://smartstore.naver.com/t-deco
20200129, 러비쉬, 이은호, 종합몰, http://smartstore.naver.com/lovish
20200128, 엠디아이 연구소(MDI Research), 송종민, 의류/패션/잡화/뷰티, http://smartstore.naver.com/sjm0763
20200128, 스타일데코카페트, 양유연, 기타, http://smartstore.naver.com/yyy1023
20200128, 옆집, 김정훈, 교육/도서/완구/오락, http://smartstore.naver.com/copenhagen
20200128, 심플엘, 김선희, 종합몰, http://smartstore.naver.com/simple_l
20200128, 하오컴퍼니, 노영호, 종합몰, http://smartstore.naver.com/elegantehome
20200128, 홍스마트, 홍윤기, 종합몰, http://smartstore.naver.com/ralashop
20200128, 비마이쥬얼리, 고유경, 의류/패션/잡화/뷰티, http://smartstore.naver.com/bemyjewelry
20200128, 황보석(HBS), 황준희, 의류/패션/잡화/뷰티, http://smartstore.naver.com/yourmine
20200128, 주식회사 더닐크팩토리, 김건하/JIKYO TAKAYUKI, 건강/식품, http://smartstore.naver.com/thenilkfactory
20200128, 개세리, 심진용, 종합몰, http://smartstore.naver.com/sjyfrequent
20200128, 플래너스, 김태평, 가구/수납용품, http://smartstore.naver.com/planners
20200128, 하영, 김현이, 의류/패션/잡화/뷰티, http://smartstore.naver.com/ninigads
20200128, 월계수상점, 장재근, 교육/도서/완구/오락, http://smartstore.naver.com/baytree1231
20200128, 케이종합금융, 양봉주, 종합몰, http://smartstore.naver.com/ktotal-service
20200128, 씨엔제이(C&J), 장욱, 건강/식품, http://smartstore.naver.com/hotwood00
20200128, 플라이투유, 조정윤, 의류/패션/잡화/뷰티, http://smartstore.naver.com/flytoyou_w
20200128, 벌루니스튜디오, 김미지, 교육/도서/완구/오락, http://smartstore.naver.com/balloonie
20200128, 베베간지, 이현정, 의류/패션/잡화/뷰티, http://smartstore.naver.com/gjbebe
20200128, 꼬꼬네, 이수완, 종합몰, http://smartstore.naver.com/cocok
20200128, 지영린, 천명숙, 종합몰, http://smartstore.naver.com/ssagemani
20200128, 제이티씨, 조은지, 종합몰, http://smartstore.naver.com/everything20
20200128, 포포스테이지, 김하늘, 종합몰, http://smartstore.naver.com/popostage
20200128, 제이엠온라인쇼핑, 제경세, 의류/패션/잡화/뷰티, http://smartstore.naver.com/jmonlineshopping
20200128, 선하테크, 권돈원, 의류/패션/잡화/뷰티/ 기타, http://smartstore.naver.com/lahel_mom
20200128, 달사, 장윤정, 종합몰, http://smartstore.naver.com/dalsa
20200128, 드르륵 앤 공방, 이혜진, 의류/패션/잡화/뷰티, http://smartstore.naver.com/drranne
20200128, 차링, 김하연, 종합몰, http://smartstore.naver.com/cha_ring
20200128, 백화팩토리, 강병각, 교육/도서/완구/오락, http://smartstore.naver.com/bhfactory
20200128, 우림-월드, 정성빈, 기타, http://smartstore.naver.com/urim_world
20200128, 원팃, 조찬민/김덕만, 종합몰, http://smartstore.naver.com/namangong
20200128, 필교상사, 방재필, 종합몰, http://smartstore.naver.com/pilgyo
20200128, 다원컴퍼니, 오경희, 의류/패션/잡화/뷰티, http://smartstore.naver.com/nbnmall
20200128, 비앤비휘트니스(킹미트), 양승훈, 건강/식품, http://smartstore.naver.com/
20200128, 러그포유, 김보현, 기타, http://smartstore.naver.com/rugforyou
20200128, 하루, 김현승, 종합몰, http://smartstore.naver.com/cotton-friend
20200128, 문？, 이광문, 종합몰, http://smartstore.naver.com/moonshop86
20200128, 지니도로시, 김윤아, 의류/패션/잡화/뷰티, http://smartstore.naver.com/kkobeulri2
20200128, 의정부 튼튼부대찌개, 어준, 건강/식품, http://smartstore.naver.com/tntnbudae
20200128, 드림리치, 김기홍, 컴퓨터/사무용품/ 건강/식품, http://smartstore.naver.com/dreampapa
20200128, 담쟁이유통, 노승두, 종합몰, http://smartstore.naver.com/shsusanfvnatkdghl/
20200128, 닥터세라바플러스, 김명숙, 의류/패션/잡화/뷰티, http://smartstore.naver.com/selavaplus
20200128, 룡아, 신성용, 가구/수납용품, http://smartstore.naver.com/seongyong
20200128, 바이(by)171, 강초은, 의류/패션/잡화/뷰티, http://smartstore.naver.com/by171
20200128, 섬띵, 안태영, 종합몰/ 건강/식품, http://smartstore.naver.com/something2
20200128, 율리마켓, 이기범, 교육/도서/완구/오락/ 의류/패션/잡화/뷰티, http://smartstore.naver.com/newdeco
20200127, 젊은친구, 오승환, 종합몰, http://smartstore.naver.com/youngbro
20200123, 익스트로버트, 국지근, 종합몰/ 기타, http://smartstore.naver.com/extrovert
20200123, 배보다 배꼽, 원인재, 교육/도서/완구/오락, http://smartstore.naver.com/baebae_creative
20200123, 승민, 이경하, 종합몰, http://smartstore.naver.com/slimbob
20200123, 루나비, 권은진, 기타, http://smartstore.naver.com/lunaby
20200123, 하이영몰, 박경은, 종합몰, http://smartstore.naver.com/haiyoungs
20200123, 애매노, 최정희, 종합몰, http://smartstore.naver.com/goodofgood
20200123, 빅히니몰, 김선미, 종합몰/ 의류/패션/잡화/뷰티, http://smartstore.naver.com/bighinnymall
20200123, 라이프플러스(Lifes Plus), 김인영, 종합몰, http://smartstore.naver.com/merhaba20
20200123, 클래식, 박지현, 의류/패션/잡화/뷰티, http://smartstore.naver.com/classichada
20200123, 포에버연, 민지연, 의류/패션/잡화/뷰티, http://smartstore.naver.com/forever_yeon
20200123, 로미바잉, 김정현, 의류/패션/잡화/뷰티, http://smartstore.naver.com/romibuying
20200123, 플렉스플러스, 윤승용, 종합몰/ 가전, http://smartstore.naver.com/flexplus
20200123, 생필품중개소, 이동호, 종합몰, http://smartstore.naver.com/dailyneed
20200123, 달디본(dal d bon), 장미경, 의류/패션/잡화/뷰티, http://smartstore.naver.com/dal-d
20200123, 준다나킹, 오세영, 종합몰, http://smartstore.naver.com/jundanaking
20200123, 프리마 스토어, 안혜민, 종합몰, http://smartstore.naver.com/hm3287
20200123, 소확행하우스, 박성현, 종합몰, http://smartstore.naver.com/giveme1004
20200123, 리빈 인 에이티스(livin in 80s), 권소영, 의류/패션/잡화/뷰티/ 기타, http://smartstore.naver.com/80shome
20200123, 바른사나이, 배진광, 종합몰, http://smartstore.naver.com/idea0967
20200123, 나나펫토리, 김인경, 의류/패션/잡화/뷰티, http://smartstore.naver.com/nana_pet
20200123, 유림화훼자재상사, 채주철, 종합몰/ 기타, http://smartstore.naver.com/yurimpot
20200123, (주)소노, 류기석, 기타, http://smartstore.naver.com/
20200123, 네이쳐소스, 박수완, 의류/패션/잡화/뷰티/ 기타, http://smartstore.naver.com/
20200123, 스타일바이라떼, 이향표, 종합몰, http://smartstore.naver.com/minvelylovely
20200123, 반려동물도감, 윤태인/조경모, 기타, http://smartstore.naver.com/
20200123, 지알리테일, 김도현, 종합몰/ 자동차/자동차용품, http://smartstore.naver.com/toru1212
20200123, 비타랩(Vita Lab), 이규덕, 종합몰, http://smartstore.naver.com/vitalab
20200123, 나나펫토리, 김인경, 의류/패션/잡화/뷰티, http://smartstore.naver.com/nana_pet
20200123, 수애천인, 김기호, 종합몰, http://smartstore.naver.com/honeysugar
20200123, 라피네(Raffine Paris), 이지영, 의류/패션/잡화/뷰티, http://smartstore.naver.com/raffine_paris
20200123, 온니유, 배가희, 의류/패션/잡화/뷰티, http://smartstore.naver.com/oniyonmaket
20200123, 동부묘목농원, 김기웅, 기타, http://smartstore.naver.com/dbtreefarm
20200123, 은우정밀, 박정원, 기타/ 종합몰, http://smartstore.naver.com/eunwoomall
20200122, 늘상, 김정미, 기타, http://smartstore.naver.com/attsang
20200122, 데일리쇼핑즈(dailyshoppings), 임수빈, 종합몰/ 의류/패션/잡화/뷰티, http://smartstore.naver.com/dailyshoppings8282
20200122, 핀아이, 김기현, 의류/패션/잡화/뷰티, http://smartstore.naver.com/pin_ai
20200122, 수수바니, 노혜란, 종합몰, http://smartstore.naver.com/susunannie
20200122, 에블린 인터네셔널, 진상희, 건강/식품/ 의류/패션/잡화/뷰티, http://smartstore.naver.com/evelynhouse
20200122, 빌리언케이(BillionK), 김경주, 종합몰, http://smartstore.naver.com/storejuna
20200122, 어바웃(ABOUT), 김슬기, 종합몰, http://smartstore.naver.com/aboutcompany
20200122, 더구떼, 정보라, 의류/패션/잡화/뷰티, http://smartstore.naver.com/jviolett
20200122, 덴티플랜, 장환진, 종합몰/ 건강/식품, http://smartstore.naver.com/maskstore
20200122, 손씨몰, 손태식, 교육/도서/완구/오락, http://smartstore.naver.com/wmfe
20200122, 은인터내셔날, 박주은, 종합몰, http://smartstore.naver.com/sadapam
20200122, 유한회사 베니스, 이승기, 의류/패션/잡화/뷰티, http://smartstore.naver.com/venice_
20200122, 아멜리아 샵, 이은영, 건강/식품/ 기타, http://smartstore.naver.com/amelia_shop
20200122, 에이엘비, 김유미, 의류/패션/잡화/뷰티, http://smartstore.naver.com/
20200122, 진성코리아, 최복녀, 종합몰/ 가전, http://smartstore.naver.com/jinsungplus
20200122, 스타벨 코리아, 지선녀, 종합몰, http://smartstore.naver.com/smart-living
20200122, 반시기, 김효순, 가전, http://smartstore.naver.com/bansigi
20200122, 다다다, 권용호, 종합몰, http://smartstore.naver.com/blankfill
20200122, 브릿지익스프레스, 이승호, 종합몰, http://smartstore.naver.com/
20200122, 디자인 요나(Design Jonah), 양정환, 종합몰, http://smartstore.naver.com/
20200122, 캠핑트렁크 은평, 임명묵, 기타, http://smartstore.naver.com/ct_ep
20200122, 드림온, 박신화, 종합몰, http://smartstore.naver.com/wish_market
20200122, 마일로, 노수정, 기타, http://smartstore.naver.com/
20200122, 선목각, 나영선, 교육/도서/완구/오락/ 가구/수납용품, http://smartstore.naver.com/sunmg
20200122, 동핏, 김동하, 종합몰, http://smartstore.naver.com/dongfit
20200122, 미니릿, 전재현, 의류/패션/잡화/뷰티, http://smartstore.naver.com/minirit
20200122, 비앤에스20(BnS20), 윤성호, 종합몰/ 의류/패션/잡화/뷰티, http://smartstore.naver.com/coldcold
20200122, 에스에이치피(SHP), 박상현, 의류/패션/잡화/뷰티, http://smartstore.naver.com/manuddine
20200122, 부티크문앤나잇, 김별, 기타, http://smartstore.naver.com/boutique_mont
20200122, 휴케이스, 박종천, 종합몰, http://smartstore.naver.com/3daymall
20200122, 이유공방, 이은정, 의류/패션/잡화/뷰티, http://smartstore.naver.com/
20200122, 하늘보리, 구보겸, 건강/식품, http://smartstore.naver.com/기초영양
20200122, 여우공간, 하영산, 의류/패션/잡화/뷰티, http://smartstore.naver.com/
20200122, 후야베베, 김현아, 의류/패션/잡화/뷰티, http://smartstore.naver.com/
20200122, 봉자자(Vonjaja), 강경수, 기타, http://smartstore.naver.com/vonjaja
20200121, 뽑짱, 김재연, 기타, http://smartstore.naver.com/msbgshop
20200121, 필더보이드(Fill the void), 이형주, 의류/패션/잡화/뷰티, http://smartstore.naver.com/fillthevoid
20200121, 커넥트, 이하연, 종합몰, http://smartstore.naver.com/connectyou
20200121, (주)넥스트레벨 코퍼레이션 목동점, 최종윤, 기타, http://smartstore.naver.com/nydance05
20200121, 호서트, 정인호, 종합몰/ 건강/식품, http://smartstore.naver.com/hoyomall
20200121, 블루밍달리아, 박은정, 종합몰, http://smartstore.naver.com/blooming_dahlia
20200121, 보나아트, 최혜연, 종합몰, http://smartstore.naver.com/bonaart
20200121, 스페이스포라이프, 권진주, 종합몰, http://smartstore.naver.com/spaceforlife
20200121, 포도알마켓, 박송이, 종합몰, 오픈마켓(http://smartstore.naver.com/podoalmarket
20200121, 미핏, 이미정, 의류/패션/잡화/뷰티, http://smartstore.naver.com/mjmifit
20200121, 빈드업(vind-up), 이세진, 의류/패션/잡화/뷰티, http://smartstore.naver.com/vind_up
20200121, 오키작업실, 전영옥, 건강/식품, http://smartstore.naver.com/ok4302
20200121, 유니크큐브, 표영진, 종합몰, http://smartstore.naver.com/uniquecube
20200121, 센스맘, 최은혜, 의류/패션/잡화/뷰티, http://smartstore.naver.com/sensemomi
20200121, 디 와이, 성기홍, 종합몰, http://smartstore.naver.com/dyleather
20200121, 몽키 베이프, 황승현, 가전/ 기타, http://smartstore.naver.com/ymonkeyvape
20200121, 모아가전, 정모음, 기타, http://smartstore.naver.com/moamoa
20200121, 신유, 유근재, 종합몰, http://smartstore.naver.com/shinayou
20200121, 늘담다, 조민준, 종합몰, http://smartstore.naver.com/neuldamda
20200121, 주식회사 제이와이커피파트너스, 양병호, 기타, http://smartstore.naver.com/jycoffeepartners
20200121, 지혜유통, 박종민, 종합몰, http://smartstore.naver.com/
20200121, 달라리, 강민정, 종합몰, http://smartstore.naver.com/smartglobalbuy
20200121, 지니몰, 김미경, 종합몰/ 기타, http://smartstore.naver.com/charlottemagic
20200121, 은하상회, 김성현, 의류/패션/잡화/뷰티, http://smartstore.naver.com/eunha_mart
20200121, 베리유(VERYYOU), 이미소, 기타, http://smartstore.naver.com/
20200121, 율이홈, 윤효진, 의류/패션/잡화/뷰티, http://smartstore.naver.com/yuleehome
20200121, 종소리상사, 김철한, 건강/식품, http://smartstore.naver.com/jongsorisangsa
20200121, 밀크페이지, 김소영, 종합몰, http://smartstore.naver.com/milkpage
20200121, 오름솔루션, 김한열, 종합몰, http://smartstore.naver.com/healthorm
20200121, 스탑, 송경근, 의류/패션/잡화/뷰티, http://smartstore.naver.com/stop0401
20200121, 물건, 고경택, 교육/도서/완구/오락, http://smartstore.naver.com/mulgunstore
20200121, 릴리즈유, 김예진, 의류/패션/잡화/뷰티, http://smartstore.naver.com/release_u
20200121, 하우스오브리, 이지니, 종합몰, http://smartstore.naver.com/hol
20200121, 피플스딜라？, 이재훈, 컴퓨터/사무용품/ 건강/식품, http://smartstore.naver.com/sdelight
20200121, 차밍골드, 심유하, 기타, http://smartstore.naver.com/charmingggold
20200121, 위드라라, 김보라, 의류/패션/잡화/뷰티, http://smartstore.naver.com/with_rara
20200121, 린데이즈(rindays), 심지현, 종합몰/ 가구/수납용품, http://smartstore.naver.com/rindays
20200121, 송월타올유유상회, 유철수, 의류/패션/잡화/뷰티, http://smartstore.naver.com/songwol2848001
20200121, 맘쏙, 천시영, 종합몰, http://smartstore.naver.com/mssok
20200121, 마켓 두나미스, 김성훈, 종합몰, http://smartstore.naver.com/marketdunamis
20200121, 허그제이, 임순범, 의류/패션/잡화/뷰티, http://smartstore.naver.com/hugjj
20200120, 비비드팡팡, 고재윤, 의류/패션/잡화/뷰티, http://smartstore.naver.com/vividpangpang
20200120, 시루빈, 이수빈, 의류/패션/잡화/뷰티, http://smartstore.naver.com/sirubin
20200120, 소통과공감, 강기원, 종합몰, http://smartstore.naver.com/shop_sogam
20200120, 더 드림(The Dream), 심혜진, 컴퓨터/사무용품/ 의류/패션/잡화/뷰티, http://smartstore.naver.com/moadream4u
