20190730, 이프너트, 하은혜, 의류/패션/잡화/뷰티, http://smartstore.naver.com/with-mannish
20190730, 오픈도어, 이은영, 건강/식품, http://smartstore.naver.com/opendoorbakery
20190730, 하이보이투앤티(HiBOYtwenty), 이승호, 의류/패션/잡화/뷰티, http://smartstore.naver.com/seungtore
20190730, 샤르메르, 조은혜, 의류/패션/잡화/뷰티, http://smartstore.naver.com/charmeur
20190730, 에꼴릭(ecolic), 주영주, 의류/패션/잡화/뷰티, http://smartstore.naver.com/ecolic
20190730, 티에스상사, 이종석, 종합몰, http://smartstore.naver.com/tsts2009
20190730, 우드앤스타일, 김진오, 종합몰, http://smartstore.naver.com/woodnstyle
20190730, (주)해빛비즈니스랩, 이지영, 종합몰, http://smartstore.naver.com/atelierhavit
20190730, 지나헤어(jina hair), 송진아, 의류/패션/잡화/뷰티, http://smartstore.naver.com/ssongbyssong_
20190730, 라벨르, 박은진, 의류/패션/잡화/뷰티, http://smartstore.naver.com/lavelle
20190729, 피그몽키(PIGMONKEY), 이지영, 의류/패션/잡화/뷰티, http://smartstore.naver.com/pigmonkey
20190729, 미하디자인, 신미라, 종합몰, http://smartstore.naver.com/this4u
20190729, 비비추, 방채정, 종합몰, http://smartstore.naver.com/daisy_daisy
20190729, 안메킹, 안미혜, 종합몰, http://smartstore.naver.com/anmene
20190729, 큰나무스토어, 정태현, 종합몰, http://smartstore.naver.com/bigtreestore
20190729, 스타일을담다, 이유나, 의류/패션/잡화/뷰티, http://smartstore.naver.com/sdam2
20190729, 엘비티 마켓(LBT market), 신성길, 종합몰, http://smartstore.naver.com/lbtmarket
20190729, 쭈꾸미샵, 이자경, 의류/패션/잡화/뷰티/ 교육/도서/완구/오락, http://smartstore.naver.com/octopus_store_
20190729, 마켓앤드림, 김동욱, 종합몰, http://smartstore.naver.com/marketzero
20190729, 주식회사 랩미, 차예린, 건강/식품, http://smartstore.naver.com/labme
20190729, 예함, 한소정, 레저/여행/공연, http://smartstore.naver.com/yeham01
20190729, 아센통상, 전성주, 종합몰/ 건강/식품, http://smartstore.naver.com/5eller
20190729, 더모먼트핏, 정수연, 의류/패션/잡화/뷰티, http://smartstore.naver.com/sooria_fit
20190729, 문라이트(Moon Light), 신연화, 기타, http://smartstore.naver.com/moonlight8288
20190729, 커먼라이프, 김효정, 기타, http://smartstore.naver.com/commonlife
20190729, 유콘시에라, 김은화, 의류/패션/잡화/뷰티, http://smartstore.naver.com/
20190729, 아뜰리에 비쥬, 정윤정, 가구/수납용품/ 기타, http://smartstore.naver.com/bijou_shop
20190729, 자전거맛집, 유정희, 기타, http://smartstore.naver.com/captaintwitter
20190729, 소쿠리스토어, 권석현, 의류/패션/잡화/뷰티/ 기타, http://smartstore.naver.com/sokuristore
20190729, 이윤세라믹 주식회사, 이태윤, 기타, http://smartstore.naver.com/serimbath
20190729, 아센통상, 전성주, 종합몰/ 건강/식품, http://smartstore.naver.com/5eller
20190729, 에제르(EZER), 박연이, 의류/패션/잡화/뷰티, http://smartstore.naver.com/ezer_
20190729, 대박적 건어물, 김민지, 건강/식품, http://smartstore.naver.com/da_bac
20190729, 연세팜, 김병규, 의류/패션/잡화/뷰티, http://smartstore.naver.com/yonseifarm
20190729, 아이윌, 윤지후, 종합몰, http://smartstore.naver.com/yunsmart
20190729, 아이엔티 솔루션, 지성훈, 종합몰/ 컴퓨터/사무용품, http://smartstore.naver.com/intsolution
20190728, 주와후(JUWAHU), 손주희, 기타, http://smartstore.naver.com/juwahu
20190728, 종합성영상사, 천성영, 종합몰, http://smartstore.naver.com/cjstjddud7104
20190726, 프라이스바바, 이효석, 종합몰, http://smartstore.naver.com/awesomemall2
20190726, 인라이트, 조학인, 종합몰, http://smartstore.naver.com/light_talktalk
20190726, 주식회사 유나미디어, 김윤아, 교육/도서/완구/오락, http://smartstore.naver.com/yunamedia
20190726, 티오피(TOP), 장준원, 종합몰, http://smartstore.naver.com/dldhswjdtnrl
20190726, 제이에스컴퍼니, 정수목, 종합몰/ 의류/패션/잡화/뷰티, http://smartstore.naver.com/tipping_point_ed
20190726, 루치아니, 김은아, 의류/패션/잡화/뷰티, http://smartstore.naver.com/luciani
20190726, 뭉뭉상점, 김지현, 건강/식품, http://smartstore.naver.com/moongmoong_store
20190726, 부티크, 최재훈, 기타, http://smartstore.naver.com/hooneey
20190726, 벨라코, 안유미, 의류/패션/잡화/뷰티, http://smartstore.naver.com/bellaco
20190726, 골든메모리즈, 윤혜미, 기타, http://smartstore.naver.com/kjhscv2020
20190726, 에이쁠, 이한나, 의류/패션/잡화/뷰티, http://smartstore.naver.com/appl_shop
20190726, 벨루칠공일(BELO 701), 배나리, 의류/패션/잡화/뷰티, http://smartstore.naver.com/hahahashop89
20190726, 에이치에스트레이드, 김학성, 종합몰, http://smartstore.naver.com/funtree
20190726, 라꿍베베, 이수정, 의류/패션/잡화/뷰티, http://smartstore.naver.com/rakkungbebe
20190726, 아침의뜰농업회사법인주식회사, 허욱, 건강/식품/ 기타, http://smartstore.naver.com/morning-garden
20190725, 레인보우아트, 민기식, 의류/패션/잡화/뷰티, http://smartstore.naver.com/rainbow-art
20190725, 아우름, 박서현, 의류/패션/잡화/뷰티, http://smartstore.naver.com/daily_aurum
20190725, 달그림 스튜디오, 이호진, 종합몰, http://smartstore.naver.com/tsukito
20190725, 제우스, 주명철, 교육/도서/완구/오락, http://smartstore.naver.com/joomc70
20190725, 올바른, 이미진, 의류/패션/잡화/뷰티, http://smartstore.naver.com/jinsbebe
20190725, 댓바니, 박민지, 의류/패션/잡화/뷰티, http://smartstore.naver.com/thatbonny
20190725, 몽키폰, 김형율, 가전, http://smartstore.naver.com/monkeypen
20190725, 슬로우(slow), 허임숙, 건강/식품, http://smartstore.naver.com/cafeslow
20190725, 소다블리, 최숙향, 종합몰/ 의류/패션/잡화/뷰티, http://smartstore.naver.com/soda_vely
20190725, 투엘피(TO.LP), 박진아/이해령, 의류/패션/잡화/뷰티, http://smartstore.naver.com/to_lp
20190725, 엠팩토리, 강문구, 종합몰, http://smartstore.naver.com/mgunfactory
20190725, 러블리블링, 정빛보라, 교육/도서/완구/오락/ 의류/패션/잡화/뷰티, http://smartstore.naver.com/lovely_bling
20190725, 디어프랜즈, 이지은, 종합몰, http://smartstore.naver.com/dear_owol
20190725, 단하나, 서하나, 의류/패션/잡화/뷰티, http://smartstore.naver.com/danhana_
20190725, 제이프롬, 성지연, 의류/패션/잡화/뷰티, http://smartstore.naver.com/duckb_b
20190725, 뚱스 포토라인(DDong's photoline), 박강일, 종합몰, http://smartstore.naver.com/ddongsphoto
20190725, 주식회사 조아라, 강설화, 종합몰, http://smartstore.naver.com/
20190725, Kplus, 정왕수, 종합몰/ 기타, http://smartstore.naver.com/customfootball
20190725, 윙크봉봉, 양지영, 의류/패션/잡화/뷰티, http://smartstore.naver.com/winkbonbon
20190725, 오미니, 오정미, 레저/여행/공연, http://smartstore.naver.com/omini
20190725, 가나안 유통, 윤정순, 가전/ 레저/여행/공연, http://smartstore.naver.com/jjapa
20190725, 세일몬, 박성규, 종합몰, http://smartstore.naver.com/sale-mon
20190725, 오디너리(Ordinary), 이소이, 의류/패션/잡화/뷰티, http://smartstore.naver.com/yourordinary
20190725, 효진이네가게, 이병철, 종합몰, http://smartstore.naver.com/koyakoya
20190725, 보케이마켓, 이보경, 종합몰, http://smartstore.naver.com/bokaymarket
20190724, 지구무역, 김현수, 의류/패션/잡화/뷰티, http://smartstore.naver.com/theplusbag
20190724, 온건투유, 연민호, 종합몰, http://smartstore.naver.com/bossmom
20190724, 디앤컴퍼니, 류다예, 종합몰, http://smartstore.naver.com/homendandas
20190724, 디테일링월드, 고태종, 자동차/자동차용품, http://smartstore.naver.com/s-lighting
20190724, 랑랑마켓, 이나래, 의류/패션/잡화/뷰티, http://smartstore.naver.com/ansdml16
20190724, 마이카데코, 윤경원, 자동차/자동차용품, http://smartstore.naver.com/mycardecoration
20190724, 주식회사 대한몰, 김연후, 종합몰, http://smartstore.naver.com/daehancompany
20190724, 또마트, 고명선, 종합몰, http://smartstore.naver.com/-tto
20190724, 제이더블류(JW), 김종완, 종합몰, http://smartstore.naver.com/jw-store
20190724, 부건무역, 박명순, 의류/패션/잡화/뷰티, http://smartstore.naver.com/furmonster
20190724, 태백할매송편, 이호상, 건강/식품, http://smartstore.naver.com/taebaekhalmae
20190724, 므아, 이소연, 의류/패션/잡화/뷰티, http://smartstore.naver.com/meua
20190724, 새벽달(Dawning-Mooooon), 정진주, 의류/패션/잡화/뷰티, http://smartstore.naver.com/Dawning_Mooooon
20190724, 석순이네 상점, 김석순, 종합몰, http://smartstore.naver.com/soonmall
20190724, 마지로브(Magie Robe), 이인영, 의류/패션/잡화/뷰티, http://smartstore.naver.com/magierobe
20190724, 스튜디오무무, 문혜원, 종합몰, http://smartstore.naver.com/
20190724, 제이드본(JDEBON), 이지민, 의류/패션/잡화/뷰티, http://smartstore.naver.com/jdebon
20190724, 아옷, 김지은, 의류/패션/잡화/뷰티, http://smartstore.naver.com/aot
20190723, 엠디투델(MD2DELL), 홍미영, 종합몰/ 컴퓨터/사무용품, http://smartstore.naver.com/md2dell
20190723, 뜻밖, 박정수, 가구/수납용품, http://smartstore.naver.com/tteutbak
20190723, 디자인스타트 주식회사, 이은정, 컴퓨터/사무용품/ 의류/패션/잡화/뷰티, http://smartstore.naver.com/archiproduct
20190723, 이레공방, 김빛나, 종합몰/ 의류/패션/잡화/뷰티, http://smartstore.naver.com/jireh1004
20190723, 주식회사 위너아트, 박서준, 종합몰, http://smartstore.naver.com/7908top
20190723, 지니스타, 김영숙, 의류/패션/잡화/뷰티, http://smartstore.naver.com/dosak1
20190723, 브리말브스(Brimalves), 양혜민, 의류/패션/잡화/뷰티, http://smartstore.naver.com/brimallves
20190723, 센스쟁이 판매퀸, 강미라, 종합몰, http://smartstore.naver.com/semsequen
20190723, 릿잇(Litit), 박지현, 의류/패션/잡화/뷰티, http://smartstore.naver.com/litit
20190723, 원더라인, 김외숙, 종합몰, http://smartstore.naver.com/wonderlineup
20190723, 찌라시닷컴, 김세종, 기타, http://smartstore.naver.com/zirashi
20190723, 피우다(PIUDA), 한혜진, 종합몰/ 의류/패션/잡화/뷰티, http://smartstore.naver.com/piudamarket
20190723, 온어데이(on a day), 박나은, 기타, http://smartstore.naver.com/on_a_day
20190723, 데일리밍(daily_ming), 허민경, 의류/패션/잡화/뷰티, http://smartstore.naver.com/mig365
20190722, 제이엘(jL), 이주현, 의류/패션/잡화/뷰티, http://smartstore.naver.com/jlcloset
20190722, 혜찬몰, 원정찬, 종합몰, http://smartstore.naver.com/hcmall-
20190722, 스그니 가죽공방, 박종규, 의류/패션/잡화/뷰티, http://smartstore.naver.com/sgnilleather
20190722, 유나네쥬띠끄, 주나경, 종합몰, http://smartstore.naver.com/jootique19
20190722, 유어바이브, 유지수, 의류/패션/잡화/뷰티, http://smartstore.naver.com/yourvibe
20190722, 노라란 잡화점, 손민수, 종합몰, http://smartstore.naver.com/noraran
20190722, 베스트앤코, 정수진, 가전/ 의류/패션/잡화/뷰티, http://smartstore.naver.com/cafemasso
20190722, 친환경 꽃우물, 이현철, 건강/식품, http://smartstore.naver.com/flowersoon
20190722, 수수한 생각상자, 김보민, 종합몰, http://smartstore.naver.com/ssthinkbox
20190722, 하루네임, 강선희, 기타, http://smartstore.naver.com/haru_name
20190722, 레드바니, 김윤수, 종합몰, http://smartstore.naver.com/redbani
20190722, 예미리Yemiri, 김강욱, 종합몰/ 의류/패션/잡화/뷰티, http://smartstore.naver.com/yemiri
20190722, 유리소미, 김민지, 의류/패션/잡화/뷰티, http://smartstore.naver.com/yuulsommy
20190722, 라피에르, 홍명수, 종합몰, http://smartstore.naver.com/LAmall
20190722, 도시어모, 유선옥, 레저/여행/공연/ 기타, http://smartstore.naver.com/fishingfarmer
20190722, 닥터카매니저, 김시정, 자동차/자동차용품, http://smartstore.naver.com/drcarmanager
20190719, 공방(handsunion), 정일문/김옥란, 의류/패션/잡화/뷰티, http://smartstore.naver.com/handsunion
20190719, 핀리스, 시영일, 컴퓨터/사무용품/ 자동차/자동차용품, http://smartstore.naver.com/finless
20190719, 홀로서기살아가기, 최솔, 종합몰, http://smartstore.naver.com/8670
20190719, 봄, 이지윤, 기타, http://smartstore.naver.com/bom_sumi
20190719, 대륙샵, 김민규, 종합몰, http://smartstore.naver.com/daeryukshop
20190719, 랄라니, PIAO LAN, 의류/패션/잡화/뷰티, http://smartstore.naver.com/lalani
20190719, 모모팔오(MoMoParo), 장지윤, 종합몰, http://smartstore.naver.com/jbgn
20190719, 에이치엠몰(HMmall), 박옥희, 종합몰, http://smartstore.naver.com/hmmall1
20190719, 여우캘리공방, 임지민, 가구/수납용품/ 기타, http://smartstore.naver.com/yeowow calligraphy
20190719, 모더니드, 이보배, 의류/패션/잡화/뷰티, http://smartstore.naver.com/moderneed
20190719, 수집상점, 서예린, 의류/패션/잡화/뷰티, http://smartstore.naver.com/soojib_store
20190718, 브런치스튜디오, 전슬기, 의류/패션/잡화/뷰티, http://smartstore.naver.com/brunch_studio
20190718, 아이덴티티커피랩, 윤원균, 건강/식품, http://smartstore.naver.com/identity_coffeelab
20190718, 주식회사 고려홍삼중앙회, 이현주, 건강/식품, http://smartstore.naver.com/hanjiwon
20190718, 이태리대디, 양영아, 의류/패션/잡화/뷰티, http://smartstore.naver.com/italydaddy
20190718, (주)웨이커스, 전충광, 가전, http://smartstore.naver.com/wakers
20190718, 재밌는 과일청년, 심도형, 기타, http://smartstore.naver.com/funniteboy
20190718, 주식회사 양지퓨너럴, 구연흥, 기타, http://smartstore.naver.com/eunhasufuneral
20190718, 꼬띠마망, 김동현, 의류/패션/잡화/뷰티, http://smartstore.naver.com/ccottimamang
20190718, 빵미네스토어, 김선명, 종합몰/ 건강/식품, http://smartstore.naver.com/beck16
20190718, 카발리에요트클럽, 이준원, 레저/여행/공연/ 기타, http://smartstore.naver.com/cavalieryachtclub
20190718, 청산청과, 나지수, 건강/식품, http://smartstore.naver.com/asakmarket
20190718, 푸른시스템, 김준석, 종합몰, http://smartstore.naver.com/filtercare
20190718, 울언니옷장, 오양자, 의류/패션/잡화/뷰티, http://smartstore.naver.com/ssangddabong_sister
20190718, 알제이(RJ), 류진태, 종합몰, http://smartstore.naver.com/rj
20190717, 오리엔탈앤트(ON), 민영인, 종합몰, http://smartstore.naver.com/orientalant
20190717, 와이에이치에스컴퍼니, 양한솔, 가전/ 자동차/자동차용품, http://smartstore.naver.com/yhsshop
20190717, 수빈한복, 우경덕, 의류/패션/잡화/뷰티, http://smartstore.naver.com/subinhanbok
20190717, 타이어yolo, 송경호, 자동차/자동차용품, http://smartstore.naver.com/tiretolo
20190717, 두들리, 이화정, 의류/패션/잡화/뷰티, http://smartstore.naver.com/doodly
20190717, 하레하레베이커리카페, 이창민, 건강/식품, http://smartstore.naver.com/harehare
20190717, 뷰티, 박서연, 종합몰, http://smartstore.naver.com/view_tea
20190717, 노마드코리아, 심은선, 종합몰, http://smartstore.naver.com/nomadstore
20190717, 포라이프, 박은희, 건강/식품, http://smartstore.naver.com/forlife
20190717, 야끼곱창, 이강숙, 건강/식품, http://smartstore.naver.com/
20190717, 더좋은퀼트, 박은정, 기타, http://smartstore.naver.com/
20190717, 힐링에어컨, 조재선, 가전, http://smartstore.naver.com/resting
20190717, 플루어즈, 오준환, 기타, http://smartstore.naver.com/fllure
20190717, 리빙잇템 샵, 이도항, 종합몰, http://smartstore.naver.com/livingittemshop
20190717, 디에이블, 최지수, 기타, http://smartstore.naver.com/miaaau
20190717, 윤자쏘잉, 김윤지, 의류/패션/잡화/뷰티, http://smartstore.naver.com/yunja-sewing
20190717, 아우내 상회, 전형재, 종합몰, http://smartstore.naver.com/yummy-season
20190717, 제이컴즈, 서재수, 기타, http://smartstore.naver.com/jcoms
20190717, 캐리어 창원 총판, 박승섭, 가전, http://smartstore.naver.com/carrierpss
20190716, 알라바스(ALABAS), 김준범, 의류/패션/잡화/뷰티, http://smartstore.naver.com/alabas
20190716, 설금당 잔기지떡, 이지인, 건강/식품, http://smartstore.naver.com/sgdjangiji
20190716, 바디스테이, 김용경/민욱기/신정환, 종합몰/ 건강/식품, http://smartstore.naver.com/bodystay
20190716, 주식회사 세이프일일구, 하용민, 의류/패션/잡화/뷰티/ 기타, http://smartstore.naver.com/safefirst
20190716, 보끄슈니, 전혜원, 종합몰, http://smartstore.naver.com/bokkshuny
20190716, ㈜아담네이처, 김동율, 의류/패션/잡화/뷰티/ 건강/식품, http://smartstore.naver.com/fermenzyme_songpa
20190716, 허니허니맘, 박은주, 기타/ 의류/패션/잡화/뷰티, http://smartstore.naver.com/heony
20190716, 진폴 JINFOL, 고안나, 가전, http://smartstore.naver.com/jinfol
20190716, 웰치 본사 특판점, 이정아, 가전, http://smartstore.naver.com/happy-kitchen
20190716, 리빙솔루션, 이효은, 종합몰/ 의류/패션/잡화/뷰티, http://smartstore.naver.com/ggsolution
20190716, 르미네일, 한아름, 의류/패션/잡화/뷰티, http://smartstore.naver.com/reumi_nail_
20190716, 고고샵, 조성배, 레저/여행/공연, http://smartstore.naver.com/gogoshop1191
20190716, 일리아나, 김지원, 교육/도서/완구/오락, http://smartstore.naver.com/iliana17
20190716, 세아공방, 이지희, 의류/패션/잡화/뷰티, http://smartstore.naver.com/seagongbang
20190716, 민트21, 사효진, 의류/패션/잡화/뷰티, http://smartstore.naver.com/mint21_
20190716, 미니베베, 김송규, 의류/패션/잡화/뷰티, http://smartstore.naver.com/minibebe
20190716, 율브릿지, 임근실, 기타, http://smartstore.naver.com/babo1004
20190716, 리빙솔루션, 이효은, 종합몰/ 의류/패션/잡화/뷰티, http://smartstore.naver.com/ggsolution
20190716, 티이엔알(TENR), 김태현, 종합몰, http://smartstore.naver.com/arm99
20190716, 사랑스러운 너(유블리마켓), 양미경, 의류/패션/잡화/뷰티, http://smartstore.naver.com/ubelymarket
20190716, 위드몰, 양근모, 의류/패션/잡화/뷰티, http://smartstore.naver.com/_windmall
20190716, 진성상회, 손재규, 종합몰, http://smartstore.naver.com/jinsungs
20190715, 시크인더스트리, 이보민, 의류/패션/잡화/뷰티, http://smartstore.naver.com/chicindustry
20190715, 에스와이코스메틱, 이경호, 의류/패션/잡화/뷰티, http://smartstore.naver.com/whitesnowmakeup
20190715, 오쉬(OSHI), 오승현, 의류/패션/잡화/뷰티, http://smartstore.naver.com/oshi
20190715, 디엑스디 뮤지엄, 이혜연, 의류/패션/잡화/뷰티, http://smartstore.naver.com/chemin_fleuri
20190715, 영천식육점, 이한국, 건강/식품, http://smartstore.naver.com/dblprime
20190715, 에브리데이뷰티, 김하준, 종합몰/ 의류/패션/잡화/뷰티, http://smartstore.naver.com/everydaybeauty
20190715, 퐁드망, 안은지, 종합몰, http://smartstore.naver.com/fondement
20190715, 샤르망미엔느, 허원석, 기타, http://smartstore.naver.com/lequotidien
20190715, 라이프디자인, 최은영, 종합몰, http://smartstore.naver.com/lifedesigner
20190715, 모이모이, 황의찬, 의류/패션/잡화/뷰티, http://smartstore.naver.com/moimoitowel
20190715, 모두팜, 김경화, 종합몰, http://smartstore.naver.com/mdpam
20190715, 비느하스, 최현우, 종합몰, http://smartstore.naver.com/phinehas
20190715, 쇼핑 아이디, 김명진, 의류/패션/잡화/뷰티, http://smartstore.naver.com/miraesquare
20190715, 지앤지-바이오푸드케어, 이규호, 종합몰/ 가전, http://smartstore.naver.com/gngshop
20190715, 겨울아이, 유길우, 의류/패션/잡화/뷰티, http://smartstore.naver.com/winterchild
20190715, 위클립(WECLIP), 이지연/신민지, 의류/패션/잡화/뷰티, http://smartstore.naver.com/weclip
20190715, 홈즈뷰티, 주한솔, 종합몰, http://smartstore.naver.com/homezbeauty
20190715, 수민ENC, 조수민, 의류/패션/잡화/뷰티, http://smartstore.naver.com/tgana
20190715, 플라잉미나(Flyingmina), 서민, 의류/패션/잡화/뷰티, http://smartstore.naver.com/flyingmina
20190715, 이너피스, 김한철, 종합몰, http://smartstore.naver.com/
20190715, 두마바티, 권민, 의류/패션/잡화/뷰티/ 교육/도서/완구/오락, http://smartstore.naver.com/dhumavati
20190715, 냥이앤독(Cat and Dog), 송세왕, 기타, http://smartstore.naver.com/yanganddog
20190715, 큐빅마일, 김소형, 종합몰, http://smartstore.naver.com/qmile
20190715, 제이에스유통, 천진욱, 교육/도서/완구/오락, http://smartstore.naver.com/jslab
20190715, 유니콘마켓, 유영선, 기타, http://smartstore.naver.com/dd2market
20190715, 지케이 비쥬, 성경배, 의류/패션/잡화/뷰티, http://smartstore.naver.com/gk_bijou
20190715, (주)동오라이프사이언스, 이승연, 종합몰/ 상품권, http://smartstore.naver.com/plants_plan
20190715, 유성상사, 이길순, 건강/식품, http://smartstore.naver.com/ruru88
20190715, 퀸앤트, 이나윤, 기타, http://smartstore.naver.com/queen-
20190713, 아이코닉, 박유신, 의류/패션/잡화/뷰티, http://smartstore.naver.com/iconic
20190712, 비미밍(bimiming), 이단비, 종합몰, http://smartstore.naver.com/bimiming
20190712, 뽀즈, 유별, 의류/패션/잡화/뷰티, http://smartstore.naver.com/bboz
20190712, 베키라이프, 이사랑, 가구/수납용품/ 기타, http://smartstore.naver.com/momo_stationery
20190712, 아이엠커피컴퍼니, 임재영, 종합몰, http://smartstore.naver.com/imcoffee
20190712, 퍼플리어린, 전혜린, 의류/패션/잡화/뷰티, http://smartstore.naver.com/purple_earrin0
20190712, 풀셋(full set), 이수혜, 의류/패션/잡화/뷰티, http://smartstore.naver.com/fullsetshop2
20190712, 블레싱(Blessing), 유수연, 종합몰, http://smartstore.naver.com/aeroshop-blessing
20190712, 로잘린, 홍선희, 의류/패션/잡화/뷰티, http://smartstore.naver.com/rosalynn
20190712, 인어의 보물섬, 최소리, 의류/패션/잡화/뷰티, http://smartstore.naver.com/mermaidstreasureisland
20190712, 더 나은 삶, 조요한, 종합몰, http://smartstore.naver.com/thebetterlife92
20190712, 모닝팜, 김승태, 건강/식품, http://smartstore.naver.com/morning_farm
20190712, 밥상차리는남편, 정지운, 건강/식품, http://smartstore.naver.com/cookinghusband
20190712, 바이데어(by there), 김새롬, 의류/패션/잡화/뷰티, http://smartstore.naver.com/bythere
20190711, 일리야 (il_y_a.), 서승일, 의류/패션/잡화/뷰티, http://smartstore.naver.com/_il_y_a
20190711, 와이리쉬 (Y.lish), 공영아, 의류/패션/잡화/뷰티, http://smartstore.naver.com/ylish
20190711, 베스트바이, 경희성, 가구/수납용품, http://smartstore.naver.com/bestbuy2018
20190711, 크로놀로지, 서진동, 종합몰/ 교육/도서/완구/오락, hhttp://smartstore.naver.com/chronology
20190711, 로얄프랑글레, 남주연, 기타/ 의류/패션/잡화/뷰티, http://smartstore.naver.com/lorrainefrance
20190711, 해브투바이(have2buy), 윤성호, 종합몰, http://smartstore.naver.com/have2buy
20190711, 위드, 임명균, 기타, http://smartstore.naver.com/withking
20190711, (주)엑시아글로벌, 박재순, 컴퓨터/사무용품, http://smartstore.naver.com/exia
20190711, 주식회사 더잇소글로벌, 김택수, 교육/도서/완구/오락, http://smartstore.naver.com/clean-up
20190711, 라벨르, 박슬기, 종합몰/ 의류/패션/잡화/뷰티, http://smartstore.naver.com/luv_labelle
20190711, 무이홈, 윤여훈, 가구/수납용품, http://smartstore.naver.com/muiiroom
20190711, 리빙다이렉트, 유형주, 의류/패션/잡화/뷰티, http://smartstore.naver.com/livingdirect
20190711, 즐겁고편한낚시, 장은옥, 종합몰, http://smartstore.naver.com/elenao
20190711, 마닉앤디자인, 김은채, 의류/패션/잡화/뷰티, http://smartstore.naver.com/manic
20190711, 농업회사법인열매나무주식회사, 김서현, 기타/ 건강/식품, http://smartstore.naver.com/thetreemall
20190710, 네일은솜씨, 이소미, 의류/패션/잡화/뷰티, http://smartstore.naver.com/sombeauty
20190710, 위즈몰, 김은희, 종합몰, http://smartstore.naver.com/wizmallss
20190710, 리더셀, 장주현, 기타, http://smartstore.naver.com/leadersell
20190710, 워니마켓, 김현정, 기타, http://smartstore.naver.com/wonnymk
20190710, 더블유피에프, 오준호, 의류/패션/잡화/뷰티, http://smartstore.naver.com/nalune/profile
20190710, 린즈띵스, 한양선, 의류/패션/잡화/뷰티, http://smartstore.naver.com/lynnsthings
20190710, 청년 씨씨티비, 조진우, 기타, http://smartstore.naver.com/guri8210
