20190213, 레몬트리하우스(LEMONTREE HOUSE), 김선희, 기타, http://smartstore.naver.com/lemonth28
20190213, 삭스파란, 권성섭, 의류/패션/잡화/뷰티, http://smartstore.naver.com/simon135
20190213, 공유가게, 신혜경, 종합몰, http://smartstore.naver.com/
20190213, 한길시스템, 박세현, 종합몰, http://smartstore.naver.com/
20190213, 페티풀(Petiful), 이은임, 의류/패션/잡화/뷰티, http://smartstore.naver.com/petiful
20190213, 원클릭(moden), 배강민, 종합몰, http://smartstore.naver.com/oneclick_moden_
20190213, 에토스컴퍼니, 강대선, 종합몰, http://smartstore.naver.com/kang_mall
20190213, 오이코스(oikos), 김수진, 종합몰, http://smartstore.naver.com/sujimstore
20190213, 주식회사 리하우스, 정은경, 종합몰/ 자동차/자동차용품, http://smartstore.naver.com/house-care
20190213, 토우토우, 최남선, 종합몰/ 의류/패션/잡화/뷰티, http://smartstore.naver.com/towtow
20190213, 오롯, 김의철, 기타, http://smartstore.naver.com/woodorot
20190213, 지니미니design, 김용태, 컴퓨터/사무용품, http://smartstore.naver.com/
20190213, 해우카메라, 전영대, 교육/도서/완구/오락/ 기타, http://smartstore.naver.com/
20190213, 아지냥이, 정재호, 기타, http://smartstore.naver.com/azinyang
20190213, 플랜트리스, 고재성, 교육/도서/완구/오락, http://smartstore.naver.com/plantrees
20190213, 미대나온남자들, 김준, 교육/도서/완구/오락/ 가구/수납용품, http://smartstore.naver.com/minams
20190213, 오지(OZ)쇼핑, 오지연, 종합몰, http://smartstore.naver.com/secretniche
20190213, 미니젬, 최경민, 의류/패션/잡화/뷰티, http://smartstore.naver.com/mini_gem
20190213, 매드아이, 김장영, 종합몰, http://smartstore.naver.com/mad-i
20190213, 달님펫, 주은혜, 기타, http://smartstore.naver.com/dalnimpet
20190213, 주주스토어, 양송이, 의류/패션/잡화/뷰티, http://smartstore.naver.com/jujustore
20190213, 혜윰컴퍼니, 이상효, 종합몰, http://smartstore.naver.com/_hyor_
20190213, 미모아썬, 최혜선, 종합몰, http://smartstore.naver.com/mimoasone
20190213, 용품박사, 이준혁, 종합몰, http://smartstore.naver.com/manyitems
20190213, 탱스티엔다, 이혜지, 종합몰, http://smartstore.naver.com/thankstienda
20190213, 나의취향, 김은영, 의류/패션/잡화/뷰티, http://smartstore.naver.com/my_taste
20190213, 코코키즈샵, 김세영, 의류/패션/잡화/뷰티, http://smartstore.naver.com/cocokidshop
20190213, 매일매일너무예쁜, 황인경, 건강/식품, http://smartstore.naver.com/_0927
20190213, 루타날코리아, 서명수, 기타, http://smartstore.naver.com/lutakorea
20190213, 지르지르, 이지현, 종합몰, http://smartstore.naver.com/zirzir88
20190213, 구필드(GUFIELD), 박성구, 의류/패션/잡화/뷰티, http://smartstore.naver.com/tjdrn1209
20190213, 프랭크토마스, 황상우, 종합몰, http://smartstore.naver.com/kimmytoys
20190212, 다스티더히든, 오원석/이주환, 건강/식품, http://smartstore.naver.com/dastihidden
20190212, 방구석 컴퍼니, 진성민, 컴퓨터/사무용품/ 가구/수납용품, http://smartstore.naver.com/h20freemall
20190212, 미비포유, 이소림, 의류/패션/잡화/뷰티, http://smartstore.naver.com/me_before_you
20190212, 루즈 끌라라(LUZ CLARA), 박화진, 의류/패션/잡화/뷰티, http://smartstore.naver.com/luz_clara
20190212, 오디파이, 강다영, 의류/패션/잡화/뷰티, http://smartstore.naver.com/odipie
20190212, 장스타, 이장원, 종합몰, http://smartstore.naver.com/ljw2637
20190212, 오토갭, 김정일, 가전/ 레저/여행/공연, http://smartstore.naver.com/tokcam
20190212, 발레타(Valleta), 이미혜, 의류/패션/잡화/뷰티, http://smartstore.naver.com/valleta
20190212, 주식회사 만나통신사, 윤승진, 종합몰, http://smartstore.naver.com/mannacompany
20190212, 김가네잡화, JIN CHUNHU, 종합몰, http://smartstore.naver.com/
20190212, 디에스(DS)메디칼, 전동현, 의류/패션/잡화/뷰티, http://smartstore.naver.com/
20190212, 에스알디(SRD), 민경득, 종합몰, http://smartstore.naver.com/
20190212, 캐리어공조, 김수영, 가전, http://smartstore.naver.com/seoulcarrier
20190212, 메디펄슨, 양희경, 건강/식품/ 기타, http://smartstore.naver.com/mediana
20190212, 숏컷샵, 정미정, 의류/패션/잡화/뷰티, http://smartstore.naver.com/
20190212, 인도어 트레블러(indoor traveler), 윤은정, 교육/도서/완구/오락/ 의류/패션/잡화/뷰티, http://smartstore.naver.com/
20190212, 네이처 하우스, 신태준, 건강/식품, http://smartstore.naver.com/
20190212, 시바견좋아, 신태훈, 종합몰, http://smartstore.naver.com/doghybird
20190212, 벨르여니, 심하윤, 의류/패션/잡화/뷰티, http://smartstore.naver.com/
20190212, 비유니크, 황수정, 의류/패션/잡화/뷰티, http://smartstore.naver.com/beuniqueuk
20190212, 끌림컴퍼니, 김영경, 의류/패션/잡화/뷰티, http://smartstore.naver.com/kklim
20190212, 런업, 박경임, 의류/패션/잡화/뷰티, http://smartstore.naver.com/verements
20190212, 서소라이프, 김소진, 기타, http://smartstore.naver.com/seosolife
20190212, 콩지샵, 황지원, 의류/패션/잡화/뷰티, http://smartstore.naver.com/kongjishop
20190212, 젠앤프로 Gen&Pro, 강티나, 의류/패션/잡화/뷰티, http://smartstore.naver.com/personal4season
20190212, 프레세르 커피로스터스, 손해옥, 건강/식품, http://smartstore.naver.com/fraicheur
20190212, 눔스하비, 문희준, 교육/도서/완구/오락, http://smartstore.naver.com/noom_hobby
20190212, 케이테이크, 고익태, 종합몰, http://smartstore.naver.com/k-take
20190212, 요고조고마켓, 강다혜, 종합몰, http://smartstore.naver.com/yogojogomarket
20190212, 리틀띵스(little things), 박윤신, 의류/패션/잡화/뷰티, http://smartstore.naver.com/littlethings_
20190212, 빛나리, 이수진, 종합몰/ 의류/패션/잡화/뷰티, http://smartstore.naver.com/leesu0903
20190212, 세건상사, 박원구, 종합몰, http://smartstore.naver.com/sgeng
20190212, 짜맞춤전수관, 최기석, 가구/수납용품/ 기타, http://smartstore.naver.com/makelearnstore
20190212, 리브영, 박진영, 종합몰, http://smartstore.naver.com/liveyoungday
20190212, 씽크로그, 김민정, 종합몰, http://smartstore.naver.com/thinglog
20190212, 리옴, 이상근, 종합몰, http://smartstore.naver.com/andromart
20190212, 이루리, 박금숙, 종합몰, http://smartstore.naver.com/
20190212, 시스벨라(SISBELLA), 송인섭, 의류/패션/잡화/뷰티, http://smartstore.naver.com/sisbella
20190212, 이룸, 이로미, 의류/패션/잡화/뷰티, http://smartstore.naver.com/eroom_2017
20190212, 마레도르이은, 이옥경, 건강/식품, http://smartstore.naver.com/mareedor
20190212, 엘라이수, 정수령, 의류/패션/잡화/뷰티, http://smartstore.naver.com/nayasoo
20190212, 유어테이블, 박민주, 가구/수납용품, http://smartstore.naver.com/foryourtable
20190212, 반월단자, 김기영, 가전/ 컴퓨터/사무용품, http://smartstore.naver.com/bwt1900
20190212, 에이치에스컴퍼니, 김형수, 종합몰, http://smartstore.naver.com/bornin74
20190212, 콩새, 표재호, 종합몰, http://smartstore.naver.com/kongse
20190212, 플랜샵, 조일주, 종합몰, http://smartstore.naver.com/
20190212, 서랍장, 장지선, 의류/패션/잡화/뷰티, http://smartstore.naver.com/
20190212, 호이포이, 석희은, 의류/패션/잡화/뷰티, http://smartstore.naver.com/
20190212, 쓰루하트, 심규호, 종합몰/ 가구/수납용품, http://smartstore.naver.com/dodam2916
20190212, 생활의발견, 최유선, 종합몰/ 자동차/자동차용품, http://smartstore.naver.com/item88
20190212, 엘라-벨, 장한경, 종합몰, http://smartstore.naver.com/ella-bell
20190212, 꿈꾸는 마리나, 김나영, 건강/식품, http://smartstore.naver.com/marina2019
20190212, 아이봉봉, 정지현, 의류/패션/잡화/뷰티, http://smartstore.naver.com/i-bonbon
20190212, 어바웃퍼펙트써클(about Perfect Circle), 이주민, 기타, http://smartstore.naver.com/monthly_memory
20190212, 수니네, 박인영, 의류/패션/잡화/뷰티/ 기타, http://smartstore.naver.com/soonine
20190212, 알트세븐틴, 오종현, 종합몰, http://smartstore.naver.com/alt7
20190212, 제이엠(JM), 유미연, 종합몰, http://smartstore.naver.com/maypick
20190212, 드림, 임철, 종합몰, http://smartstore.naver.com/olllim
20190212, 나른한 설레임, 주다혜, 기타, http://smartstore.naver.com/mona_nudo
20190212, 모두드림스토어, 배상범, 종합몰, http://smartstore.naver.com/modedream
20190212, 주잡상인, 신은주, 종합몰, http://smartstore.naver.com/jujapsangin
20190212, 유앤아이-ui, 김지현, 종합몰, http://smartstore.naver.com/uni36
20190212, 복순이네, 함초롱, 의류/패션/잡화/뷰티, http://smartstore.naver.com/wingdress
20190212, 디앤와이플라스코, 김경환, 가구/수납용품/ 기타, http://smartstore.naver.com/dnyplasco
20190212, 스티치드, 양유철, 레저/여행/공연/ 상품권, http://smartstore.naver.com/
20190212, 저스템, 류찬우, 종합몰, http://smartstore.naver.com/justtem
20190212, 포맘, 박지용, 가전, http://smartstore.naver.com/s777
20190212, 다미상사, 최남, 종합몰, http://smartstore.naver.com/lusaa
20190212, 한걸음생활연구소, 윤은아, 종합몰, http://smartstore.naver.com/onestepahead
20190212, 믈리, 박경원, 의류/패션/잡화/뷰티, http://smartstore.naver.com/brick-berry
20190212, 더푸른, 박선아, 교육/도서/완구/오락/ 가구/수납용품, http://smartstore.naver.com/greenphotosun
20190212, 져재 de SANFUN, 추헌, 의류/패션/잡화/뷰티, http://smartstore.naver.com/jeojaedesanfun
20190212, 유유상사, 강영애, 의류/패션/잡화/뷰티, http://smartstore.naver.com/uutc
20190212, 세븐에이트, 박희순, 종합몰, http://smartstore.naver.com/0708
20190211, 리틀믹스, 김성은, 종합몰, http://smartstore.naver.com/littlemixx
20190211, 버닝댄스학원, 이예주, 교육/도서/완구/오락/ 의류/패션/잡화/뷰티, http://smartstore.naver.com/burningdance
20190211, 이로샵, 김성연, 의류/패션/잡화/뷰티, http://smartstore.naver.com/2ro2shop
20190211, 굿모닝 바디, 오승재, 종합몰, http://smartstore.naver.com/gmbody
20190211, 라이트라잇, 김승수, 교육/도서/완구/오락/ 의류/패션/잡화/뷰티, http://smartstore.naver.com/sellkin
20190211, 유원트스토어, 이정관, 종합몰, http://smartstore.naver.com/youwantstore
20190211, 바라, 박시영, 가구/수납용품, http://smartstore.naver.com/orangkea
20190211, 주식회사 데비마이어 아시아, YOO KATIE MYUNGHEE, 기타, http://smartstore.naver.com/debbiemeyer
20190211, 제더스, 서연희, 기타, http://smartstore.naver.com/
20190211, 만대산, 허상진, 의류/패션/잡화/뷰티, http://smartstore.naver.com/
20190211, 지야(ZIYA), 전승연, 의류/패션/잡화/뷰티, http://smartstore.naver.com/ziya
20190211, 굿쇼핑, 황보영, 종합몰, http://smartstore.naver.com/goodssp
20190211, 나마라뮤즈, 남아현, 종합몰/ 상품권, http://smartstore.naver.com/
20190211, 문달룸, 이슬이, 의류/패션/잡화/뷰티, http://smartstore.naver.com/
20190211, 은재마트, 신주희, 종합몰, http://smartstore.naver.com/
20190211, 가고 (GAGO), 홍원기, 가구/수납용품, http://smartstore.naver.com/gago
20190211, 후르츠샵, 박형수, 건강/식품, http://smartstore.naver.com/furutsushop
20190211, 모노멜란지, 김은규, 의류/패션/잡화/뷰티, http://smartstore.naver.com/monomelange
20190211, 엠에이치랜드, 문현철, 종합몰, http://smartstore.naver.com/mhcland
20190211, 현미박사누룽지 방이점, 권현애, 건강/식품, http://smartstore.naver.com/brownrice_bangi
20190211, 마크앤코, 김다정/김미정, 기타, http://smartstore.naver.com/marknco
20190211, 아이랑즈, 양은경, 의류/패션/잡화/뷰티, http://smartstore.naver.com/yanggaeng
20190211, 더그로브, 김다영, 의류/패션/잡화/뷰티, http://smartstore.naver.com/the_grove
20190211, 옥포에프앤비(주), 김향희, 건강/식품, http://smartstore.naver.com/haega
20190211, 휴가앤일리오, 정승환, 건강/식품, http://smartstore.naver.com/cafeillio
20190211, 로또네잡화점, 황소연, 의류/패션/잡화/뷰티, http://smartstore.naver.com/lottone
20190211, 구두쌀롱, 김연희, 의류/패션/잡화/뷰티, http://smartstore.naver.com/shoes_ssalon
20190211, 유락공방, 최정윤, 교육/도서/완구/오락, http://smartstore.naver.com/youlak
20190211, 라블루 (La Blu), 배우리, 의류/패션/잡화/뷰티, http://smartstore.naver.com/lablu
20190211, 우유로치즐, 장석영, 컴퓨터/사무용품, http://smartstore.naver.com/cheesemilk
20190211, 할인시스템, 전경인, 종합몰, http://smartstore.naver.com/
20190211, 에스이제이, 심은정, 의류/패션/잡화/뷰티, http://smartstore.naver.com/sej-shine
20190211, 슈퍼맨상사, 장대환, 종합몰, http://smartstore.naver.com/jobdongsaninara
20190211, 은인몰, 김은숙, 레저/여행/공연, http://smartstore.naver.com/euninmall
20190211, 슬기로운 생활, 주슬기, 건강/식품, http://smartstore.naver.com/juice_pop
20190211, 테이트 모던, 조용덕, 가구/수납용품, http://smartstore.naver.com/tate_modern
20190211, 픽업, 이민지, 의류/패션/잡화/뷰티, http://smartstore.naver.com/thepickup
20190211, 바비펫샵, 김수정, 의류/패션/잡화/뷰티, http://smartstore.naver.com/petgrooming
20190211, 전창현의행복한커피집, 전창현, 건강/식품, http://smartstore.naver.com/wizcoffee
20190211, 니니발렌, 박혜리, 의류/패션/잡화/뷰티, http://smartstore.naver.com/ninibalen
20190211, 요나광고기획, 황순환, 기타, http://smartstore.naver.com/yona-art
20190211, 에이프릴, 안정은, 의류/패션/잡화/뷰티, http://smartstore.naver.com/goyangapril
20190211, 로라몰, 노예정, 종합몰/ 의류/패션/잡화/뷰티, http://smartstore.naver.com/lalamall
20190211, 꿀품몰, 김설희, 종합몰, http://smartstore.naver.com/aconite
20190211, 행복한다발, 조경민, 종합몰, http://smartstore.naver.com/happiness9
20190211, 리치피플, 이슬기, 종합몰, http://smartstore.naver.com/huiyoon
20190211, 앤줄라이플라워, 우승현, 의류/패션/잡화/뷰티, http://smartstore.naver.com/andjunlyhome
20190211, 바이더유(By the U), 김윤희, 의류/패션/잡화/뷰티, http://smartstore.naver.com/by_the_u
20190211, 오라몰, 오승용, 종합몰, http://smartstore.naver.com/oramal
20190211, 라운드워터, 류진우, 종합몰, http://smartstore.naver.com/
20190211, 헤파이스토스웍스 주식회사, 이두희, 기타, http://smartstore.naver.com/
20190211, 해피데이 토퍼, 강지혜, 의류/패션/잡화/뷰티, http://smartstore.naver.com/happydaytopper
20190211, 레오스토어, 신대호, 종합몰, http://smartstore.naver.com/heybro_
20190211, 웨어드로잉, 양지원, 의류/패션/잡화/뷰티, http://smartstore.naver.com/weardrawing
20190211, 익투스0423, 고유진, 종합몰, http://smartstore.naver.com/ictus0423
20190211, 블루베리독, 안슬기, 기타, http://smartstore.naver.com/blue_n_berry
20190211, 착한파머스, 황인경, 건강/식품, http://smartstore.naver.com/ckf
20190211, 청호산업, 정영호, 기타, http://smartstore.naver.com/tkzndi123
20190211, 끄적끄적, 김민석, 교육/도서/완구/오락, http://smartstore.naver.com/rnlskd
20190211, 차머니스토어, 김복순, 종합몰, http://smartstore.naver.com/chamoneystore
20190211, 키네틱체인, 박미나, 종합몰, http://smartstore.naver.com/kinetic11
20190211, 애견명가, 이창영, 기타, http://smartstore.naver.com/dogmyoungga
20190211, 헤이림스토어, 김해정, 종합몰, http://smartstore.naver.com/heyrim
20190211, 농업회사법인 경북친환경농산물주식회사, 이승환, 건강/식품, http://smartstore.naver.com/ggoggam
20190211, 미디에이트, 이가람, 종합몰, http://smartstore.naver.com/howtube
20190211, 뚱뽀백화점, 안종화, 종합몰, http://smartstore.naver.com/ddongbbostore
20190210, 펩스토어, 박현서, 종합몰, http://smartstore.naver.com/pepstore
20190210, 블링루비, 김정미, 의류/패션/잡화/뷰티, 블링루비  http://smartstore.naver.com/bllubi
20190210, 오늘의 미래, 박미래, 교육/도서/완구/오락/ 의류/패션/잡화/뷰티, http://smartstore.naver.com/todaysfuture
20190210, (주)보물상자, 이은우, 종합몰, http://smartstore.naver.com/bigshowmarket
20190210, 홍홍점, 민재홍, 종합몰, http://smartstore.naver.com/hhongstore
20190210, 프로타곤(PROTAGON), 성하림, 의류/패션/잡화/뷰티, http://smartstore.naver.com/protagon
20190210, 키마무드, 김아영, 의류/패션/잡화/뷰티, http://smartstore.naver.com/kimamood
20190210, 하프투쓰, 이은주, 의류/패션/잡화/뷰티, http://smartstore.naver.com/harptwos
20190210, 소유, 정영림, 의류/패션/잡화/뷰티/ 종합몰, http://smartstore.naver.com/dressmonster
20190210, 솝랜드, 장혜정, 종합몰, http://smartstore.naver.com/sensibleherb
20190210, 에바다마켓, 정재록, 종합몰, http://smartstore.naver.com/sixtee
20190210, 오늘더예뻐, 박선영, 의류/패션/잡화/뷰티, http://smartstore.naver.com/the_yeppeo
20190210, 하뚜시스터, 이하영, 의류/패션/잡화/뷰티, http://smartstore.naver.com/hattusisters
20190210, 오아시스시티 파트너, 옥철식, 기타, http://smartstore.naver.com/oasiscity
20190210, 로드헨, 이희조, 종합몰/ 기타, http://smartstore.naver.com/dabid5
20190210, 겟썸레스트, 김수임, 종합몰/ 의류/패션/잡화/뷰티, http://smartstore.naver.com/getagoodrest
20190210, 자연속사람, 정은헌, 종합몰, http://smartstore.naver.com/heun1000000
20190210, 바른 소비 생활 연구소, 유인애, 종합몰, http://smartstore.naver.com/buywelllab
20190210, 봄오래, 권우석, 기타, http://smartstore.naver.com/
20190210, 유니즈룸, 신윤정, 의류/패션/잡화/뷰티, http://smartstore.naver.com/unizroom
20190210, 드림스(DREAMS), 강구종, 종합몰, http://smartstore.naver.com/
20190210, 정담, 유지수, 건강/식품, http://smartstore.naver.com/
20190210, 블리오, 오성은, 종합몰, http://smartstore.naver.com/s525
20190210, 킹덤오브킹스, 한경진, 의류/패션/잡화/뷰티, http://smartstore.naver.com/
20190210, 솔젬쥬얼리, 방도훈, 의류/패션/잡화/뷰티, http://smartstore.naver.com/solgemjewelry
20190210, 트리거컴퍼니, 서제석, 교육/도서/완구/오락, http://smartstore.naver.com/shukshuk_daitso
20190210, 열린상회, 김수정, 종합몰, http://smartstore.naver.com/10rin
20190210, 더 만들다, 최하영, 기타, http://smartstore.naver.com/thecreate
20190210, 1987스토어, 신유향, 종합몰/ 의류/패션/잡화/뷰티, http://smartstore.naver.com/1987store
20190210, 퍼플포레스트, 이효석, 가구/수납용품/ 의류/패션/잡화/뷰티, http://smartstore.naver.com/purpleforest
20190209, 드링크워터, 정대영, 건강/식품, http://smartstore.naver.com/drinkwater
20190209, 혜연들, 정희아, 교육/도서/완구/오락/ 레저/여행/공연, http://smartstore.naver.com/hyeyeondeul
20190209, 코코요이, 최혜정, 종합몰, http://smartstore.naver.com/코코요이
20190209, 그라엘(GRAILE), 나연서, 의류/패션/잡화/뷰티, http://smartstore.naver.com/graile
20190209, 건그래그, 김재석, 교육/도서/완구/오락, http://smartstore.naver.com/gungrag
20190209, 직구투유얼홈, 신은호, 종합몰, http://smartstore.naver.com/airpodspot
20190209, 스타일n, 윤용선, 종합몰, http://smartstore.naver.com/stylenshop
20190209, 굿즈월드, 전나정, 종합몰, http://smartstore.naver.com/thegoodsworld
20190209, 삼십육점오(36.5), 서제니, 의류/패션/잡화/뷰티, http://smartstore.naver.com/everyday_365
20190209, 홈무늬, 조문경, 가구/수납용품, http://smartstore.naver.com/mooning
20190209, 디어리본, 장하나, 의류/패션/잡화/뷰티, http://smartstore.naver.com/dearreborn
20190209, 영로 인터내셔널, 전영순, 의류/패션/잡화/뷰티, http://smartstore.naver.com/sieg fahrenheit
20190209, 미니두(minidoo), 강경희, 교육/도서/완구/오락/ 의류/패션/잡화/뷰티, http://smartstore.naver.com/minidoo
20190209, 코젠트리, 하혜진, 교육/도서/완구/오락/ 의류/패션/잡화/뷰티, http://smartstore.naver.com/cogentry
20190209, 노너울, 임창우, 종합몰, http://smartstore.naver.com/magics
20190209, 캘리비쥬, 이세현, 기타, http://smartstore.naver.com/cbijou
20190209, 양수가든, 윤종현, 건강/식품, http://smartstore.naver.com/yangsugarden
20190209, 아미앙쥬 ami_ange, 이윤경, 의류/패션/잡화/뷰티, http://smartstore.naver.com/ami_ange_
20190209, 작은생각, 윤치국/한상우, 건강/식품, http://smartstore.naver.com/smallgoodthing
20190209, 은평양행, 윤재철, 건강/식품, http://smartstore.naver.com/swsq
20190209, 품바, 김승훈, 종합몰, http://smartstore.naver.com/pumbaas
20190209, 청아래핑, 김영오, 종합몰/ 기타, http://smartstore.naver.com/reknow
20190209, 포르투나, 이승애, 가구/수납용품/ 자동차/자동차용품, http://smartstore.naver.com/
20190209, 셀럽, 오정원, 의류/패션/잡화/뷰티, http://smartstore.naver.com/
20190209, 오군-Store, 오진철, 의류/패션/잡화/뷰티/ 건강/식품, http://smartstore.naver.com/ohgunstore
20190209, 느루, 남길윤, 의류/패션/잡화/뷰티, http://smartstore.naver.com/inter-lude
20190209, 시리(SiRi)텔레콤, 윤종인, 가전/ 기타, http://smartstore.naver.com/siri_telecom
20190209, 창조유통, 조철희, 기타, http://smartstore.naver.com/haestore
20190209, 삽다리한우방정육점, 유용득, 건강/식품, http://smartstore.naver.com/sigolgogi
20190209, 샤이닝핸드, 이지향, 종합몰, http://smartstore.naver.com/jejumind
20190209, 엠듀유통, 서호정, 종합몰/ 의류/패션/잡화/뷰티, http://smartstore.naver.com/mdue
20190208, 비커머스, 박찬준, 기타, http://smartstore.naver.com/swimgear
20190208, 만물상훈, 서상훈, 종합몰, http://smartstore.naver.com/manmulsh
20190208, 다누(DANU), 강석영, 종합몰, http://smartstore.naver.com/danu_market
20190208, 맨쿨레저, 김미정, 의류/패션/잡화/뷰티/ 레저/여행/공연, http://smartstore.naver.com/mencool
20190208, 하늘옷장, 김보영, 의류/패션/잡화/뷰티, http://smartstore.naver.com/skybig
20190208, 기린반원준이, 손원준, 종합몰, http://smartstore.naver.com/kirinwonjun
20190208, 주식회사 에프빈코리아, 김정수, 종합몰/ 의류/패션/잡화/뷰티, http://smartstore.naver.com/
20190208, 코드우드, 손지오, 종합몰/ 기타, http://smartstore.naver.com/codewood
20190208, 옥탑스토어, 정승택, 종합몰, http://smartstore.naver.com/oktopstore
20190208, 빨간아트, 송대영, 종합몰, http://smartstore.naver.com/purringcat
20190208, 포토？(PHOTO SHARP), 최정희, 기타, http://smartstore.naver.com/photosharp
20190208, 에떼(ete), 이민희, 의류/패션/잡화/뷰티, http://smartstore.naver.com/eteswimwear
20190208, 린드, 이미선, 의류/패션/잡화/뷰티, http://smartstore.naver.com/lind_
20190208, 우블리샵, 이창준, 의류/패션/잡화/뷰티, http://smartstore.naver.com/dark10800
20190208, 노블레스(noblesse), 김종경, 가구/수납용품, http://smartstore.naver.com/kyoung232
20190208, 생활연구소, 안민아, 종합몰, http://smartstore.naver.com/applefanboy
20190208, 호로록스토어, 박형진, 종합몰, http://smartstore.naver.com/
20190208, 베리굿즈, 김명준, 컴퓨터/사무용품, http://smartstore.naver.com/johso
20190208, 그레이, 이유미, 가전/ 의류/패션/잡화/뷰티, http://smartstore.naver.com/greyone
20190208, 예그리데이, 김혜정, 의류/패션/잡화/뷰티/ 기타, 인스타그램.http://smartstore.naver.com/yegree day. 카카오톡 플러스친구 http://pf.kakao.com/_mxlSNj
20190207, 다운솔루션주식회사, 정운용, 교육/도서/완구/오락/ 컴퓨터/사무용품, http://smartstore.naver.com/daunsolution
20190207, 나인업9(Nine Up9), 유영님, 의류/패션/잡화/뷰티/ 레저/여행/공연, http://smartstore.naver.com/nineup9
20190207, 에스제이, 맹선영, 종합몰, http://smartstore.naver.com/sj4388
20190207, 이레 하트인아트(Heart in Art), 임이레, 교육/도서/완구/오락/ 기타, http://smartstore.naver.com/heartinart
20190207, 지스 컬렉션(JIS collection), 김은정, 의류/패션/잡화/뷰티, http://smartstore.naver.com/jis2017
20190207, 나자린, 정승련, 의류/패션/잡화/뷰티, http://smartstore.naver.com/nazarene
20190207, 아이엠 키 컴퍼니, 이기승, 의류/패션/잡화/뷰티, http://smartstore.naver.com/kate24
20190207, 물보라, 김세훈, 종합몰, http://smartstore.naver.com/sat2191
20190207, 에프이에스, 김종완, 종합몰, http://smartstore.naver.com/
20190207, 꽃/일다, 김인애, 기타, http://smartstore.naver.com/
