20190409, 어데이인, 장재화, 의류/패션/잡화/뷰티, http://smartstore.naver.com/adayin
20190409, 자이언트 킴, 김민규, 의류/패션/잡화/뷰티/ 종합몰, http://smartstore.naver.com/giant_kim
20190409, 골무와 실타래, 노금랑, 종합몰, http://smartstore.naver.com/yournacho
20190409, 리오독, 진창식, 기타, http://smartstore.naver.com/leodog2019
20190409, 시헌테크, 유재천, 기타, http://smartstore.naver.com/topfilter
20190409, 아일랜드, 김태성, 레저/여행/공연, http://smartstore.naver.com/islandpension
20190409, 일공공일안경원, 신종우 외1명, 의류/패션/잡화/뷰티, http://smartstore.naver.com/cj1001optical
20190409, 웜모먼트, 이미경, 의류/패션/잡화/뷰티, http://smartstore.naver.com/warmmoment
20190409, 엠디코리아, 김미경, 종합몰, http://smartstore.naver.com/mdk-mall
20190409, 동그라미안경, 강수진, 종합몰, http://smartstore.naver.com/cubeoptics
20190409, 하나스런, 최하나, 의류/패션/잡화/뷰티, http://smartstore.naver.com/hanaswirun
20190408, 슈토, 김재효, 의류/패션/잡화/뷰티/ 건강/식품, http://smartstore.naver.com/shuto
20190408, 론박(RonPark), 최아론, 의류/패션/잡화/뷰티, http://smartstore.naver.com/ronpark
20190408, 릴라리에, 이효주, 의류/패션/잡화/뷰티, http://smartstore.naver.com/lilaslier
20190408, 이십사인치(24inch), 김지원, 의류/패션/잡화/뷰티, http://smartstore.naver.com/24inch_diet
20190408, 대도떡집, 이진상, 건강/식품, http://smartstore.naver.com/daedo1110
20190408, 윤에스테틱, 이윤, 의류/패션/잡화/뷰티, http://smartstore.naver.com/yuniyuni62
20190408, 동보기업, 이주연, 종합몰, http://smartstore.naver.com/dbachab
20190408, 이노몰, 노종복, 종합몰/ 기타, http://smartstore.naver.com/enomail
20190408, 대제종합물류센터, 박명중, 종합몰, http://smartstore.naver.com/daejemall
20190408, 글로우, 유경진, 종합몰, http://smartstore.naver.com/glow7599
20190408, 블람블람, 김아람, 종합몰/ 의류/패션/잡화/뷰티, http://smartstore.naver.com/blramblram
20190408, 주식회사 서우, 노갑수, 기타, http://smartstore.naver.com/seowu
20190408, 생선팔이소녀, 신다혜, 건강/식품/ 기타, http://smartstore.naver.com/afishgirl
20190407, 진방, 이상용, 종합몰, http://smartstore.naver.com/airpur
20190405, 문화공작소, 양나리, 의류/패션/잡화/뷰티, http://smartstore.naver.com/onlyl-4you
20190405, 맘마누, 이희석, 기타, http://smartstore.naver.com/mammamu
20190405, 쁘음, 최미주, 의류/패션/잡화/뷰티, http://smartstore.naver.com/2ppeum
20190405, 라이크, 송재홍, 종합몰, http://smartstore.naver.com/
20190405, 드림씨앤씨, 김낙필, 종합몰, http://smartstore.naver.com/dreamcnc114
20190405, 브레드필, 이혜진, 건강/식품, http://smartstore.naver.com/
20190405, 에이치제이스토어, 손현정, 종합몰, http://smartstore.naver.com/lovepack
20190405, 브로큰, 김훈, 컴퓨터/사무용품, http://smartstore.naver.com/iphoneking
20190405, 베리베리, 문주영, 종합몰/ 의류/패션/잡화/뷰티, http://smartstore.naver.com/e-berryberry
20190405, 더 바른, 박소윤, 의류/패션/잡화/뷰티, http://smartstore.naver.com/yogawithme
20190405, 지안비코, 한동수, 종합몰, http://smartstore.naver.com/gianvico
20190405, 와이제이코리아, 황연자, 종합몰, http://smartstore.naver.com/ongar1004
20190405, 아름다운 얼굴, 장석원, 의류/패션/잡화/뷰티, http://smartstore.naver.com/whyw
20190405, 티아베이프(TiaVape), 이은정, 가전, http://smartstore.naver.com/tiavape
20190405, 주식회사 모스터일렉, 김보민, 컴퓨터/사무용품, http://smartstore.naver.com/mosterelecshop
20190404, 씨드느와, 이호원, 의류/패션/잡화/뷰티, http://smartstore.naver.com/cdenoirs
20190404, 베베시따, 배크리스탈, 의류/패션/잡화/뷰티, http://smartstore.naver.com/bebecita
20190404, B디자인 가게, 강혜숙, 컴퓨터/사무용품/ 의류/패션/잡화/뷰티, http://smartstore.naver.com/bbibbibbung
20190404, 와와펫, 최현우, 종합몰/ 기타, http://smartstore.naver.com/nalraripet
20190404, 지씨알컴퍼니, 김희, 종합몰, http://smartstore.naver.com/gcrcompany
20190404, 주식회사 로드로드, 조윤성, 교육/도서/완구/오락, http://smartstore.naver.com/meahproject
20190404, 시크 원, 박상녕, 의류/패션/잡화/뷰티, http://smartstore.naver.com/jisoomi
20190404, 포치포치, 신한나, 의류/패션/잡화/뷰티, http://smartstore.naver.com/
20190404, 호주구매대행, 조은성, 건강/식품, http://smartstore.naver.com/
20190404, 늘 피어나(neul pieona), 황정옥, 기타, http://smartstore.naver.com/
20190404, 퓨어라인, 박준희, 종합몰, http://smartstore.naver.com/pureline
20190404, 로즈인뉴욕(Rose In New York), 정예원, 기타/ 의류/패션/잡화/뷰티, http://smartstore.naver.com/roseinnewyork
20190404, 영희네 보석상자, 전혜선, 교육/도서/완구/오락, http://smartstore.naver.com/y2_box
20190404, 사이다팩토리, 이상준, 종합몰/ 가구/수납용품, http://smartstore.naver.com/ciderfactory
20190404, 앤드IT, 조성용, 종합몰, http://smartstore.naver.com/nd_store
20190404, 티케이ENG, 이태겸, 의류/패션/잡화/뷰티, http://smartstore.naver.com/kongssuni_mama
20190404, 예나빈, 김항숙, 종합몰, http://smartstore.naver.com/yenabin
20190404, 스타폭스(STARFOX), 안태오, 종합몰, http://smartstore.naver.com/amita
20190404, 오케이에어컨, 안미영, 가전, http://smartstore.naver.com/okaircon
20190404, 마이드림, 이준영, 종합몰, http://smartstore.naver.com/
20190404, 라이프랩, 박세헌, 의류/패션/잡화/뷰티, http://smartstore.naver.com/lifelab_4u
20190404, 단지마켓, 김다미, 의류/패션/잡화/뷰티, http://smartstore.naver.com/dams_market
20190404, 헤어살롱엠, 이세형, 의류/패션/잡화/뷰티, http://smartstore.naver.com/hairsalonm
20190404, 보벨라(beaubella), 곽민정, 컴퓨터/사무용품/ 의류/패션/잡화/뷰티, http://smartstore.naver.com/sachi_
20190404, 이모저모, 황현지, 교육/도서/완구/오락, http://smartstore.naver.com/design_momo
20190404, 루이네, 김민정, 의류/패션/잡화/뷰티, http://smartstore.naver.com/boodood11
20190404, 키덜트몰, 배강현, 종합몰, http://smartstore.naver.com/molbi
20190404, 골프커머스, 임무희, 종합몰/ 레저/여행/공연, http://smartstore.naver.com/golfcommerce
20190404, 러블리제이(Lovely J), 허수현, 의류/패션/잡화/뷰티, http://smartstore.naver.com/lovely___j___
20190403, 피플인스토리, 박효성, 종합몰, http://smartstore.naver.com/peopleinstore
20190403, 모은공방, 김다혜, 교육/도서/완구/오락/ 기타, http://smartstore.naver.com/moeun_studio
20190403, 블레스K, 김인실, 의류/패션/잡화/뷰티, http://smartstore.naver.com/blessk
20190403, 이세상, 이용진, 종합몰, http://smartstore.naver.com/thisworld
20190403, 투원컴퍼니, 김원규, 컴퓨터/사무용품/ 자동차/자동차용품, http://smartstore.naver.com/sinagoyo/twowon
20190403, 버터, 정희성, 기타, http://smartstore.naver.com/kappajs
20190403, 셀럽문, 문보경, 종합몰/ 의류/패션/잡화/뷰티, http://smartstore.naver.com/celebmoon_
20190403, 사막여우, 최미겸, 기타, http://smartstore.naver.com/herbarium_jha
20190403, 미지하우스, 이미지, 교육/도서/완구/오락/ 의류/패션/잡화/뷰티, http://smartstore.naver.com/slmj
20190403, 빈 캔들, 이근영, 기타, http://smartstore.naver.com/beancandle
20190403, 윈상사, 민교식, 기타, http://smartstore.naver.com/winwinline
20190403, 에이치앤에이 스토어 [HnA store], 이은애, 가전/ 의류/패션/잡화/뷰티, http://smartstore.naver.com/ttm2
20190403, 앤솔로지 엔터프라이즈, 임광민, 종합몰, http://smartstore.naver.com/anthologyshop
20190403, 에스엔디 (SND), 김도형, 종합몰, http://smartstore.naver.com/shogall
20190403, 파크파크, 박건휘/박광규, 종합몰, http://smartstore.naver.com/parkpark
20190403, 하람블루베리농장, 이민우, 종합몰, http://smartstore.naver.com/blueberries
20190403, 드보르, 최나영, 의류/패션/잡화/뷰티, http://smartstore.naver.com/dvor
20190403, 라온, 김연덕, 종합몰, http://smartstore.naver.com/raum-store
20190403, 카프로제트(Carproz), 진승언, 종합몰, http://smartstore.naver.com/carproz
20190403, 주식회사 메쉬, 이주성, 종합몰, http://smartstore.naver.com/meshonline
20190403, 히온(hion), 조옥경, 의류/패션/잡화/뷰티, http://smartstore.naver.com/velyhion
20190403, 디에스피, 박대성, 종합몰, http://smartstore.naver.com/myong
20190403, 썬데이무드, 문은선, 의류/패션/잡화/뷰티, http://smartstore.naver.com/_sundaymood_
20190403, 옥갈비, 옥주영, 건강/식품, http://smartstore.naver.com/ockcompany
20190402, 에이맨즈, 김미은, 의류/패션/잡화/뷰티, http://smartstore.naver.com/a-mans
20190402, 주식회사 미쉘리, 이미경, 종합몰/ 성인/성인용품, http://smartstore.naver.com/secretmax
20190402, 에이블미디어커머스, 박노운, 의류/패션/잡화/뷰티, http://smartstore.naver.com/hot_store
20190402, 펫두들, 장원, 교육/도서/완구/오락/ 의류/패션/잡화/뷰티, http://smartstore.naver.com/petdoodle
20190402, 심플리온, 김수경, 의류/패션/잡화/뷰티, http://smartstore.naver.com/
20190402, 38엔트리(38ENTRY), 임동환, 종합몰, http://smartstore.naver.com/my.cholce
20190402, 마음피트니스, 권민희, 교육/도서/완구/오락, http://smartstore.naver.com/
20190402, 인사이트솔루션, 이호준, 종합몰, http://smartstore.naver.com/domangkaja
20190402, 피에스커머스, 박상현, 컴퓨터/사무용품, http://smartstore.naver.com/pscommerce
20190402, 기프티팝, 이승환, 종합몰, http://smartstore.naver.com/giftipop
20190402, 디앤디 엔 에스아이(DND&SI), 유현경, 자동차/자동차용품, http://smartstore.naver.com/dndsi
20190402, 오드오드, 안신영, 종합몰, http://smartstore.naver.com/oddodd
20190402, 바른생활프로젝트, 강도윤, 종합몰, http://smartstore.naver.com/goodlifeproject
20190402, 뮤토, 박선주, 의류/패션/잡화/뷰티, http://smartstore.naver.com/mutofarm
20190402, 주식회사88후드(88Hood Co./Ltd.), 임정민, 기타, http://smartstore.naver.com/strair8rt
20190402, 레브팔레트, 이예지, 종합몰, http://smartstore.naver.com/reve_
20190402, 쫑핏, 김종완, 의류/패션/잡화/뷰티, http://smartstore.naver.com/poete
20190402, 바이엔유, 노지혜, 종합몰/ 건강/식품, http://smartstore.naver.com/by_nu
20190402, 델플레인(Dell plain), 고아라, 의류/패션/잡화/뷰티, http://smartstore.naver.com/dellplain
20190402, 러빈미, 김가빈, 의류/패션/잡화/뷰티, http://smartstore.naver.com/binnari
20190402, 블러썸 미디어(Blossom Media), 지영주, 상품권, http://smartstore.naver.com/blossom-studio
20190402, 고양전자, 이원배, 가전, http://smartstore.naver.com/leewb
20190402, 바이 아도람, 박주연, 의류/패션/잡화/뷰티, http://smartstore.naver.com/adoram
20190402, 뷰덱, 고준후, 의류/패션/잡화/뷰티, http://smartstore.naver.com/beaudec
20190402, 담다, 이호민, 기타, http://smartstore.naver.com/dam_da_
20190402, 아이씨푸드, 강인대, 건강/식품, http://smartstore.naver.com/icfood
20190402, 엣지아이, 김은영, 의류/패션/잡화/뷰티, http://smartstore.naver.com/55846500
20190401, 쇼핑프렌드, 연진모, 교육/도서/완구/오락, http://smartstore.naver.com/shoppingfriend
20190401, 달서랍, 권정아, 기타, http://smartstore.naver.com/dal_seorap
20190401, 캐치미(catch me), 권용석, 의류/패션/잡화/뷰티, http://smartstore.naver.com/catch_me
20190401, 모도, 이한나, 종합몰, http://smartstore.naver.com/modo_hannah
20190401, 워니비니라미(wonnybinnyrammy), 문혜원/박찬빈/고아람, 의류/패션/잡화/뷰티, http://smartstore.naver.com/oh_hi_5_ohio
20190401, 핑크러쉬, 김지영, 종합몰, http://smartstore.naver.com/pinkrush486
20190401, 쿠마 인터네셔날, 임미령, 종합몰, http://smartstore.naver.com/kurmaint
20190401, 마로스, 이진우, 건강/식품, http://smartstore.naver.com/nutsb
20190401, 지나홀릭, 변원진, 종합몰, http://smartstore.naver.com/ginaholic
20190401, 에브리싱글데이(every single day), 가예연, 의류/패션/잡화/뷰티, http://smartstore.naver.com/esd_official
20190401, 케이컴퍼니, 김지현, 종합몰, http://smartstore.naver.com/_kcompany
20190401, 너무좋아, 이용희, 의류/패션/잡화/뷰티, http://smartstore.naver.com/lyhe0421
20190401, 솝퍼리(soapery), 서효정, 의류/패션/잡화/뷰티, http://smartstore.naver.com/soapery_gangnam
20190401, 코지도쿄, 지수현, 의류/패션/잡화/뷰티, http://smartstore.naver.com/cozytokyo
20190401, 작당, 이영미, 기타, http://smartstore.naver.com/jakdang_ing
20190401, 에이에프티알, 박이후, 의류/패션/잡화/뷰티, http://smartstore.naver.com/aftr
20190401, 그리니에브리데이, 이연지, 교육/도서/완구/오락, http://smartstore.naver.com/greenyeveryday
20190401, 제이s스토어, 김형곤, 종합몰, http://smartstore.naver.com/keyworder
20190401, 이븐이프, 이유경, 의류/패션/잡화/뷰티, http://smartstore.naver.com/evenif
20190401, 더미미샵, 강수연, 종합몰/ 의류/패션/잡화/뷰티, http://smartstore.naver.com/littlepop
20190401, 에스티유, 백승민, 컴퓨터/사무용품, http://smartstore.naver.com/stu850
20190401, 카페체리빈스, 임애숙, 건강/식품, http://smartstore.naver.com/cherrybeans_w
20190401, 홈까사(HOME CASA), 김성진, 종합몰/ 기타, http://smartstore.naver.com/home_casa
20190401, 블루메빈티지, 강은영, 기타, http://smartstore.naver.com/blumevintage
20190401, 주식회사 펀앤플레이, 김범준, 종합몰/ 컴퓨터/사무용품, http://smartstore.naver.com/funplay
20190401, 방스골프아카데미, 방창식, 기타, http://smartstore.naver.com/bangsgolf
20190401, 문라이트커머스, 박문영, 의류/패션/잡화/뷰티, http://smartstore.naver.com/moonlight_store
20190401, 오펜하임, 이동원, 기타, http://smartstore.naver.com/89block
20190401, 베베쥬, 안효정, 의류/패션/잡화/뷰티, http://smartstore.naver.com/bebeju2014
20190401, 은트리(EUN TREE), 김은지, 의류/패션/잡화/뷰티, http://smartstore.naver.com/euntree
20190401, 혜이호(hye2ho), 김혜수, 의류/패션/잡화/뷰티, http://smartstore.naver.com/hye2ho
20190401, 꼼지쌈지, 장수현, 종합몰, http://smartstore.naver.com/ccomja
20190401, 트리니티, 강경필, 종합몰, http://smartstore.naver.com/fine_scent
20190401, 카멜레월, 김상기, 가구/수납용품, http://smartstore.naver.com/chamelewall
20190401, 가든스더베이(GARDENS THE BAY), 이나림, 기타, http://instagram.com/botanique http://smartstore.naver.com/botanique___
20190401, 스텔라호, 김유리, 레저/여행/공연, http://smartstore.naver.com/stellafishing
20190329, 오엠지걸, 권다미, 의류/패션/잡화/뷰티, http://smartstore.naver.com/omgirl
20190329, 황금모피, 황승지, 의류/패션/잡화/뷰티, http://smartstore.naver.com/goldfur_kr
20190329, 아라쏘, 정소담, 의류/패션/잡화/뷰티, http://smartstore.naver.com/arasso
20190329, 료이서울(RYOI SEOUL), 심려진, 의류/패션/잡화/뷰티, http://smartstore.naver.com/ryoi-seoul
20190329, 한국마라내츄럴 서울목동지사, 이정미, 건강/식품/ 기타, http://smartstore.naver.com/marahnatural
20190329, 실감마켓, 주미현, 종합몰, http://smartstore.naver.com/hyd33
20190329, 브랜드피케이(BrandPK), 유진욱, 의류/패션/잡화/뷰티, http://smartstore.naver.com/BrandPK
20190329, 올마켓, 배지원, 종합몰, http://smartstore.naver.com/no1allmarket
20190329, 업힐로드, 박소진, 의류/패션/잡화/뷰티, http://smartstore.naver.com/_uphillroad
20190329, 이음 목공방, 최정수, 가구/수납용품, http://smartstore.naver.com/joshua_ww
20190329, 로로얼로이, 이희령, 의류/패션/잡화/뷰티, http://smartstore.naver.com/loloalloy
20190329, 라이크 어 에이프릴, 신은숙, 의류/패션/잡화/뷰티/ 건강/식품, http://smartstore.naver.com/like_a_april
20190329, 토화랑, 김형준, 기타, http://smartstore.naver.com/thr
20190329, 코스트마인드, 황재윤, 종합몰/ 컴퓨터/사무용품, http://smartstore.naver.com/chwangstore
20190329, 늘솜뜨개, 최지영, 의류/패션/잡화/뷰티, http://smartstore.naver.com/neulsom
20190329, 개밥안주냥, 김혜경, 기타, http://smartstore.naver.com/dog_cat_food
20190328, 암잡이닷컴, 박근찬, 종합몰, http://smartstore.naver.com/amJAbi
20190328, 에스엘컴퍼니, 신성광, 종합몰, http://smartstore.naver.com/jjoyfulshop
20190328, 제이앤장스토어, 장영자, 가전, http://smartstore.naver.com/jjvapers
20190328, 미라클, 이승용, 의류/패션/잡화/뷰티/ 컴퓨터/사무용품, http://smartstore.naver.com/miraclebox
20190328, 사진공방TOOK, 박종성, 기타, http://smartstore.naver.com/tookfoto
20190328, 로미엔(LOMI.N), 정준일, 의류/패션/잡화/뷰티, http://smartstore.naver.com/lomi_n
20190328, 차츰, 신소연, 의류/패션/잡화/뷰티, http://smartstore.naver.com/chacheum_
20190328, 워너베의 구멍가게, 김원배, 가전, http://smartstore.naver.com/wons-shop
20190328, 동구휴대폰백화점, 윤창섭, 의류/패션/잡화/뷰티, http://smartstore.naver.com/1most
20190328, 쏭지팩토리, 송지민, 교육/도서/완구/오락, http://smartstore.naver.com/byssongg
20190328, 꽃과숲, 유민지, 의류/패션/잡화/뷰티, http://smartstore.naver.com/kimyk2019
20190328, 에이치(H), 김현주, 의류/패션/잡화/뷰티, http://smartstore.naver.com/h7
20190328, 포커스펫, 배숙주, 기타, http://smartstore.naver.com/focuspet
20190328, 킹원스토어, 정종기, 의류/패션/잡화/뷰티, http://smartstore.naver.com/kingone
20190328, (주)티엔상사, 심기열, 종합몰, http://smartstore.naver.com/tnswco83
20190328, 바이리안, 안태형, 의류/패션/잡화/뷰티, http://smartstore.naver.com/tycompany
20190328, 크레들(cradle), 마현경, 의류/패션/잡화/뷰티, http://smartstore.naver.com/cradle
20190328, 더나루, 유안진, 의류/패션/잡화/뷰티, http://smartstore.naver.com/thenaru
20190328, 제하임, 류제하, 의류/패션/잡화/뷰티, http://smartstore.naver.com/jeahaim
20190328, 모어베이스(more base), 이혜림, 의류/패션/잡화/뷰티, http://smartstore.naver.com/rimi43
20190328, 모모조이, 이영숙, 종합몰, http://smartstore.naver.com/momojoy7777
20190327, 이지댄스학원, 김기현, 기타, http://smartstore.naver.com/sinchonez
20190327, 에스비 트레이딩(SB-Trading), 장성봉, 자동차/자동차용품, http://smartstore.naver.com/starcar10
20190327, 엠에프유통, 유지연, 기타, http://smartstore.naver.com/myfunnyysmartstore
20190327, 리앤하커머스, 이종은, 종합몰, http://smartstore.naver.com/kcnc
20190327, 낭만쇼핑, 이지연, 종합몰, http://smartstore.naver.com/nangmanmart
20190327, 옥배마켓, 류상현, 종합몰, http://smartstore.naver.com/ogbae
20190327, 레시피랩, 곽정환, 종합몰/ 컴퓨터/사무용품, http://smartstore.naver.com/recipelab
20190327, 아라종합광고기획, 김성원, 의류/패션/잡화/뷰티/ 건강/식품, http://smartstore.naver.com/arashop7
20190327, 더(THE)자람, 박하은, 의류/패션/잡화/뷰티/ 종합몰, http://smartstore.naver.com/thezaram
20190327, 들숨, 김문경, 종합몰, http://smartstore.naver.com/deulsum
20190327, 코코바이올린(COCOVIOLYN), 강나리, 의류/패션/잡화/뷰티, http://smartstore.naver.com/cocoviolyn
20190327, 엑스씨지트레이딩, 정주영, 의류/패션/잡화/뷰티, http://smartstore.naver.com/xcg-trading
20190327, 맛찬들왕소금구이, 이정훈, 건강/식품, http://smartstore.naver.com/mcdmoran
20190327, 루먼스타, 서민희, 의류/패션/잡화/뷰티, http://smartstore.naver.com/lumen_star
20190327, 에델, 박인자, 의류/패션/잡화/뷰티, http://smartstore.naver.com/edeledel
20190327, 두레 스마트푸드, 정두례/천상운, 건강/식품, http://smartstore.naver.com/haejok
20190327, 또치언니, 이선화, 의류/패션/잡화/뷰티, http://smartstore.naver.com/subless
20190327, 사과네 잡화점, 채보라, 기타, http://smartstore.naver.com/apple_store
20190327, 허브관세무역컨설팅, 김진욱, 종합몰/ 의류/패션/잡화/뷰티, http://smartstore.naver.com/hub-CTC
20190327, 복플레이스, 복지윤, 의류/패션/잡화/뷰티, http://smartstore.naver.com/richaroma19
20190327, 온에어 시스템, 송온숙, 가전, http://smartstore.naver.com/onair_system
20190327, 한국타이어 T-station 벽제관산점, 이대영, 자동차/자동차용품, http://smartstore.naver.com/tire7979
20190327, 도서출판100, 김지호, 교육/도서/완구/오락, http://smartstore.naver.com/100book
20190327, 쁘야, 임지현, 의류/패션/잡화/뷰티, http://smartstore.naver.com/abcstore
20190327, 믿음마켓, 김신용, 종합몰, http://smartstore.naver.com/creditkim
20190327, 꼬미쉐프, 노재남, 건강/식품, http://smartstore.naver.com/commischef
20190327, 아뜰리에담, 김혜경, 의류/패션/잡화/뷰티, http://smartstore.naver.com/atelierdam
20190327, 강원공방쿠룬타갤러리, 박성주, 건강/식품, http://smartstore.naver.com/
20190327, 뉴발란스 원주중앙, 김경리, 의류/패션/잡화/뷰티, http://smartstore.naver.com/newbalance
20190327, 은은하게, 고현정, 의류/패션/잡화/뷰티, http://smartstore.naver.com/은은하게
20190327, 오집(O zip), 임희정, 종합몰, http://smartstore.naver.com/o_zip
20190327, 난다롱, 박정아, 의류/패션/잡화/뷰티, http://smartstore.naver.com/nandarong_
20190326, 써니포스트릿, 유자연, 의류/패션/잡화/뷰티, http://smartstore.naver.com/bigbigmantoman
20190326, 이안스(ian's), 이은혜, 종합몰/ 의류/패션/잡화/뷰티, http://smartstore.naver.com/ians
20190326, 대성물산, 원종율, 종합몰/ 건강/식품, http://smartstore.naver.com/daesung181225
20190326, 코리아 미디어센터, 김대현, 종합몰, http://smartstore.naver.com/koreamediacenter
20190326, 사운드앤디자인(SND), 황형철, 기타, http://smartstore.naver.com/
20190326, 곤이네, 장세곤, 종합몰, http://smartstore.naver.com/damagochi29
20190326, 리노블, 이동희, 의류/패션/잡화/뷰티, http://smartstore.naver.com/lnoble
20190326, 원스페이스, 임철순, 가구/수납용품/ 기타, http://smartstore.naver.com/onespace
20190326, 표범과 복숭아, 박나람, 기타, http://smartstore.naver.com/naram_naram
20190326, 주식회사 마이유니폼, 남윤정, 종합몰, http://smartstore.naver.com/withmedi
20190326, 주식회사 유니드코퍼레이션, 노평환, 종합몰, http://smartstore.naver.com/selavi1
20190326, 코스베리, 이영재, 종합몰, http://smartstore.naver.com/cosvery
20190326, 러플로썸 RUFFLELOSSOM, 차한나, 의류/패션/잡화/뷰티, http://smartstore.naver.com/rufflelossom
20190326, 율, 임성율, 종합몰, http://smartstore.naver.com/miscellaneousstore
20190326, 뷰티플포레스트, 김현수, 종합몰, http://smartstore.naver.com/chuchu7
20190326, 베베이푸(BebeYifu), 김도훈, 의류/패션/잡화/뷰티, http://smartstore.naver.com/bebeyifu
20190326, 케이디와이게임즈, 김도윤, 기타, http://smartstore.naver.com/kdygames
20190326, 사사오오육육(445566), 이가은, 의류/패션/잡화/뷰티, http://smartstore.naver.com/44556677
20190326, 도깨비풀, 유현진, 기타, http://smartstore.naver.com/dokaebipul
20190326, 제이에이치마켓, 김지혜, 의류/패션/잡화/뷰티, http://smartstore.naver.com/daisy/house
20190326, 민스샵, 김민서, 의류/패션/잡화/뷰티, http://smartstore.naver.com/mins_shop
20190326, 언니쓰, 안순영, 의류/패션/잡화/뷰티, http://smartstore.naver.com/unnijjang
20190326, 영심이네, 김영심, 의류/패션/잡화/뷰티/ 자동차/자동차용품, http://smartstore.naver.com/0sim_store
20190326, 무비, 곽영화, 의류/패션/잡화/뷰티, http://smartstore.naver.com/ii8i8ii
20190325, 어피코크, 장정희, 의류/패션/잡화/뷰티, http://smartstore.naver.com/aclevas
20190325, 월드홈, 김대영, 종합몰, http://smartstore.naver.com/panda7
20190325, 진영상사, 이진영/이창준, 종합몰/ 기타, http://smartstore.naver.com/jinyoungco
20190325, 올랩케어스, 김영옥, 종합몰, http://smartstore.naver.com/alllabcares
20190325, 아메리칸제이인터내셔널, 오종훈, 종합몰/ 의류/패션/잡화/뷰티, http://smartstore.naver.com/american
20190325, 넥솔, 심석규, 종합몰/ 기타, http://smartstore.naver.com/necsol
20190325, 예리 코퍼레이트(Yeri corp.), 김예리, 종합몰, http://smartstore.naver.com/yeripark
20190325, 아델리에, 이남유, 의류/패션/잡화/뷰티, http://smartstore.naver.com/adelatatto
